975	801	kentousuru	けんとうする	検討する	
976	802	subarashii	すばらしい	素晴らしい	 wonderful, splendid, magnificent
977	803	kaisaisuru	かいさいする	開催する	
977	804	hidari	ひだり	左	 left, left hand side, さ (左)  left (esp. in vertical Japanese writing), the following
979	805	itai	いたい	痛い	painful, sore | cringy, embarrassing | exceeding
980	806	otosu	おとす	落とす	to drop, to lose, to let fall, to shed (light), to cast (one's gaze), to pour in (liquid), to leave behind | to clean off (dirt, makeup, paint, etc.), to remove (e.g. stains or facial hair), to lose, to spend money at a certain place, to omit, to leave out, to secretly let escape | to lose (a match), to reject (an applicant), to fail (a course), to defeat (in an election) | to lower (e.g. shoulders or voice), to lessen (e.g. production or body weight), to worsen (quality), to reduce (e.g. rank or popularity), to speak badly of, to make light of, to fall into straitened circumstances | to fall into (e.g. a dilemma or sin), to make one's own, to have one's bid accepted, to force surrender, to take (e.g. an enemy camp or castle), to forcefully convince, to press for a confession, to deal with | to download, to copy from a computer to another medium | to make someone swoon (judo) | to finish a story (e.g. with the punch line) | to finish (a period, e.g. of fasting)
981	807	aki	あき	秋	time, hour, moment | occasion, case | chance, opportunity, season | the times, the age, the day | tense, あき (秋)  autumn, fall
982	808	yubi	ゆび	指	 finger, toe, digit, さし (差し) between (e.g. two people), face to face | hindrance, impediment | arrhythmic section of recitative in noh music | playing with only 2 players | prefix used for stress or emphasis | counter for traditional dance songs
983	809	giron	ぎろん	議論	 argument, discussion, dispute, controversy
984	810	nioi	におい	匂い	odour, odor, scent, smell, stench | aura, whiff, smacks of ..., sense, flavour, flavor
985	811	musubu	むすぶ	結ぶ	to tie, to bind, to link | to bear (fruit) | to close (e.g. deal), to confirm, to conclude | to connect (two distant places) | to close tightly, to purse (e.g. lips) | to unite (with), to ally, to join hands
987	812	iki	いき	息	breath, breathing | tone, mood, むすこ (息子) son | penis, そく (息) son | interest (on a loan, deposit, etc.)
988	813	zenzen	ぜんぜん	全然	(not) at all, (not) in the slightest | wholly, entirely, completely, totally | extremely, very
989	814	nagameru	ながめる	眺める	to look at, to gaze at, to watch, to stare at | to look out over, to get a view of, to admire (e.g. the scenery) | to look on (from the sidelines), to stand by and watch, to observe
990	815	keikaku	けいかく	計画	 plan, project, schedule, scheme, program, programme
994	816	ossharu	おっしゃる	仰る	 to say, to speak, to tell, to talk
995	817	soretomo	それとも	其れとも	
996	818	ikkai	いっかい	一回	 once, one time, one round, one game, one bout, one heat, one inning
997	819	taido	たいど	態度	attitude, manner, behaviour, demeanour, bearing | attitude (towards an issue, etc.), position, stance, stand
998	820	zairyou	ざいりょう	材料	ingredients, material | material (for a novel, experiment, etc.), subject matter, data | basis (for a decision), grounds, evidence | (market) factor
999	821	youyaku	ようやく	漸く	finally, at last | barely, narrowly, hardly, only just | gradually, little by little, by degrees
1000	822	unazuku	うなずく	頷く	 to nod, to bow one's head in assent, to agree
1001	823	shizuka	しずか	静か	quiet, silent | slow, unhurried | calm, peaceful
1003	824	moukeru	もうける	設ける	to prepare, to provide | to set up, to establish, to organize, to lay down (rules), to make (an excuse)
1004	825	ai	あい	愛	love, affection, care | attachment, craving, desire | agape | Ireland, まな (愛)  beloved, dear
1005	826	keikou	けいこう	傾向	 tendency, trend, inclination
1006	827	onnanoko	おんなのこ	女の子	girl, daughter, baby girl | young woman, めのこ (女の子)  woman, girl
1007	828	nouryoku	のうりょく	能力	 ability, faculty, のうりき (能力)  low-ranking priest who does manual labour at a temple, male temple employee
1008	829	chishiki	ちしき	知識	 knowledge, information
1009	830	nareru	なれる	成れる	
1010	831	wakeru	わける	分ける	to divide (into), to split (into), to part, to separate, to divide up, to classify, to sort out, to divide out | to share, to distribute, to deal out, to dish out | to distinguish, to discriminate, to differentiate (between) | to break up (a fight), to mediate | to call a draw, to tie | to push one's way through (a crowd) | to sell
1011	832	naku	なく	泣く	 to cry, to weep, to sob, to howl
1012	833	zenbu	ぜんぶ	全部	 all, entire, whole, altogether
1013	834	oku	おく	奥	 inner part, inside, interior, depths (e.g. of a forest), back (of a house, drawer, etc.), bottom (e.g. of one's heart), recesses, heart
1014	835	ichinen	いちねん	一年	 one year, some time ago
1014	836	fun'iki	ふんいき	雰囲気	atmosphere, mood, ambience, ambiance, aura, feel | a certain air, presence, special aura, something (about someone) | (Earth's) atmosphere
1016	837	tsurai	つらい	辛い	spicy, hot | salty | harsh (criticism), severe (punishment), strict | painful, bitter, difficult, tough, つらい (辛い) painful, bitter, heart-breaking, difficult (emotionally) | tough, difficult, hard (usu. of situations) | cruel, harsh, cold, づらい (辛い)  difficult to ..., hard to ...
1018	838	wotsuujite	をつうじて	を通じて	
1019	839	zenkoku	ぜんこく	全国	 the whole country
1020	840	teikyousuru	ていきょうする	提供する	
1021	841	chi	ち	地	earth, ground, land, soil | place | territory | bottom (of a package, book, etc.) | earth (one of the five elements), つち (土) earth, soil, dirt, clay, mud | the earth (historically, esp. as opposed to the heavens), the ground, the land | low-quality torinoko-gami (containing mud) | (period of) refraining from construction in the direction of the god of the earth (in Onmyōdō), じ (地) ground, land, earth, soil | the region in question, the local area | skin | texture, fabric, material, weave | base, background | one's true nature | narrative (i.e. descriptive part of a story) | real life, actuality | captured territory (in the game of go) | noh chorus | accompaniment music (in Japanese dance) | basic phrase (in Japanese music; usu. repetitive) | base part (of multiple shamisens)
1022	842	beikoku	べいこく	米国	 (United States of) America, USA, US
1023	843	setteisuru	せっていする	設定する	
1024	844	oku	おく	於く	
1025	845	kotae	こたえ	答え	 answer, reply, response, solution
1025	846	shourai	しょうらい	将来	 future (usually near), prospects
1027	847	setchisuru	せっちする	設置する	
1028	848	uma	うま	馬	horse | horse racing | promoted bishop
1030	849	nichi	にち	日	day, days | sun, sunshine, sunlight | (the) day, daytime, daylight | date, deadline | (past) days, time (e.g. of one's childhood) | case (esp. unfortunate), event, にち (日) Sunday | day (of the month) | counter for days | Japan, か (日) day of month | counter for days
1031	850	otozureru	おとずれる	訪れる	to visit, to call on | to arrive (season, time, situation, etc.), to come, to appear | to make a sound | to send a letter, to inquire about a letter
1032	851	tassuru	たっする	達する	 to reach, to get to, to arrive at
1033	852	namida	なみだ	涙	tear, tears, lachrymal secretion | sympathy
1034	853	issou	いっそう	一層	much more, still more, all the more, more than ever | single layer (or storey, etc.) | rather, sooner, preferably
1035	854	kaesu	かえす	返す	to return (something), to restore, to put back | to turn over, to turn upside down, to overturn | to pay back, to retaliate, to reciprocate | to respond (with), to retort, to reply, to say back | to do ... back (e.g. speak back, throw back) | to do again, to do repeatedly
1036	855	zannen	ざんねん	残念	 deplorable, regrettable, disappointing, vexing, unfortunate
1037	856	tooru	とおる	通る	to go by, to go past, to go along, to travel along, to pass through, to use (a road), to take (a route), to go via, to go by way of | to run (between; of a rail service, bus route, etc.), to operate (between), to connect | to go indoors, to go into a room, to be admitted, to be shown in, to be ushered in, to come in | to penetrate, to pierce, to skewer, to go through, to come through | to permeate, to soak into, to spread throughout | to carry (e.g. of a voice), to reach far | to be passed on (e.g. of a customer's order to the kitchen), to be relayed, to be conveyed | to pass (a test, a bill in the House, etc.), to be approved, to be accepted | to go by (a name), to be known as, to be accepted as, to have a reputation for | to be coherent, to be logical, to be reasonable, to be comprehensible, to be understandable, to make sense | to get across (e.g. of one's point), to be understood | to pass for, to come across as, to seem like | to be straight (e.g. wood grain) | to be well-informed, to be wise | to do ... completely, to do ... thoroughly
1039	857	teki	てき	敵	rival, opponent, adversary, competitor, enemy (esp. one with which there is longstanding enmity), foe | revenge | spouse, てき (敵) opponent, rival, adversary | menace, danger, threat, enemy
1040	858	yatto	やっと	漸と	at last, finally | barely, narrowly, just, by the skin of one's teeth
1041	859	shuui	しゅうい	周囲	surroundings, environs | circumference
1042	860	sagyou	さぎょう	作業	 work, operation, manufacturing, fatigue duty
1043	861	kioku	きおく	記憶	memory, recollection, remembrance | storage
1044	862	shisetsu	しせつ	施設	institution, establishment, facility | home (for elderly, orphans, etc.)
1045	863	fuyu	ふゆ	冬	 winter
1046	864	kyuu	きゅう	急	sudden, abrupt, unexpected | urgent, pressing | steep, sharp, precipitous | rapid, swift, fast | emergency, crisis, danger | urgency, hurrying, haste | (in gagaku or noh) end of a song
1047	865	rieki	りえき	利益	profit, gains | benefit, advantage, interest (of the public, etc.) | grace (of God, Buddha, etc.) (esp. as attained through rightful actions, prayer, adherence to one's faith, etc.), blessing, miracle
1048	866	kusuri	くすり	薬	medicine, pharmaceuticals, (legal) drugs, pill, ointment, salve | efficacious chemical (gunpowder, pesticide, etc.) | (pottery) glaze | (illegal) drug, narcotic | small bribe, やく (薬)  dope, narcotic, drug
1050	867	sasaeru	ささえる	支える	to support, to prop, to sustain, to underlay, to hold up, to defend | to hold at bay, to stem, to check, つかえる (閊える) to stick, to get stuck, to get caught, to get jammed, to clog | to be unavailable, to be busy, to be occupied, to be full | to be piled up (e.g. of work) | to halt (in one's speech), to stumble (over one's words), to stutter, to stammer | to feel blocked (of one's chest or throat, due to grief, anxiety, illness, etc.), to feel pressure, to feel pain
1051	868	sakebu	さけぶ	叫ぶ	to shout, to cry, to scream, to shriek, to yell, to exclaim | to clamor (for or against), to clamour (for or against)
1051	869	jijou	じじょう	事情	 circumstances, conditions, situation, reasons, state of affairs
1053	870	muryou	むりょう	無料	 free (of charge), gratuitous
1054	871	sentakusuru	せんたくする	選択する	
1055	872	ryou	りょう	量	quantity, amount, volume, capacity, portion (of food) | generosity, magnanimity, tolerance | pramana, (in Indian philosophy) means by which one gains accurate and valid knowledge, はか (捗)  progress
1056	873	bunka	ぶんか	文化	culture, civilization, civilisation | Bunka era (1804.2.11-1818.4.22)
1057	874	bun	ぶん	分	minute (unit of time) | fun (one tenth of a monme, 5.787 grains), ぶ (分) one-tenth, one percent (one-tenth of a wari), 3 mm (one-tenth of a sun), 2.4 mm (one-tenth of a mon, a traditional unit used to measure shoe sizes), 0.1 degree (one-tenth of a do, used to measure body temperature on any temperature scale) | one-quarter of a ryō (obsolete unit of currency) | thickness | advantageous circumstances | one-tenth of a monme of silver, ぶん (分) part, portion, share | amount, worth (as in "two days' worth"), enough (for) | one's means, one's place, one's lot, one's social position | one's duty, one's part | condition, state (of affairs), extent, rate (as in "at this rate") | in proportion to, just as much as, to the same degree | content (e.g. alcohol), percentage | equivalent to (e.g. an old brother)
1059	875	torikumu	とりくむ	取り組む	to grapple with, to wrestle with, to engage in a bout, to be matched against | to tackle (e.g. a problem), to come to grips with, to work hard on
1060	876	neko	ねこ	猫	cat (esp. the domestic cat, Felis catus) | shamisen | geisha | wheelbarrow | clay bed-warmer | bottom, submissive partner of a homosexual relationship, ねこま (猫)  cat
1061	877	dankai	だんかい	段階	 grade, level, stage, class, phase, steps, order, gradation, きざはし (階) stairs | stairs at the front of a noh stage
1062	878	soshiki	そしき	組織	organization, organisation, formation | structure, construction, setup, constitution | system (e.g. railroad, transport, party, etc.) | tissue | texture (of a rock) | weave (of a fabric)
1063	879	yuku	ゆく	行く	to go, to move (in a direction or towards a specific location), to head (towards), to be transported (towards), to reach | to proceed, to take place | to pass through, to come and go | to walk | to die, to pass away | to do (in a specific way) | to stream, to flow | to continue | to have an orgasm, to come, to cum | to trip, to get high, to have a drug-induced hallucination
1064	880	sukunakutomo	すくなくとも	少なくとも	 at least
1064	881	happyousuru	はっぴょうする	発表する	
1066	882	omoi	おもい	重い	heavy, weighty | heavy (feeling), depressed, gloomy, blue, uneasy | slow, sluggish, lumbering, ponderous, clumsy | important (position, responsibility, etc.), serious, grave | serious (punishment, illness, etc.), severe, critical | solid, established, dignified, sensible
1068	883	uede	うえで	上で	
1069	884	ryouri	りょうり	料理	cooking, cookery, cuisine, meal, food, dish, item on a menu | dealing with something, handling, administration, management
1070	885	toriaezu	とりあえず	取り敢えず	first of all, at once, right away | for now, for the time being
1071	886	ninki	にんき	人気	popularity, public favor | condition (e.g. market), tone, character, nature, ひとけ (人気) sign of life, human presence | humanity, humaneness, じんき (人気)  prevailing mood of a locality, emotional climate of a district
1072	887	nigeru	にげる	逃げる	 to escape, to run away
1073	888	oyobu	およぶ	及ぶ	to reach, to amount to, to befall, to happen to, to extend, to go on (for, until) | to be up to the task, to come up to | to compare with, to be a match (for) | to commit (a crime) | to require (to do)
1074	889	tekisetsu	てきせつ	適切	 appropriate, suitable, fitting, apt, proper, right, pertinent, relevant
1075	890	hakkensuru	はっけんする	発見する	
1077	891	ou	おう	追う	to chase, to run after, to pursue, to follow after | to follow (a set order, a trend, etc.) | to drive out, to get rid of, to oust, to expel | to drive (e.g. a herd) | to be pressed (e.g. for time)
1079	892	shinbun	しんぶん	新聞	 newspaper
1080	893	osoi	おそい	遅い	slow, time-consuming, sluggish | late (in the day), towards the end (of the day or night), until a time far into the day or night | later (than expected or usual), late, behind schedule, behind time, tardy, overdue, unpunctual | too late, having missed the boat | dull, stupid
1081	894	kounyuusuru	こうにゅうする	購入する	
1082	895	tou	とう	問う	to ask, to inquire | to blame (someone) for, to accuse of, to pursue (question of responsibility), to charge with | to care about, to regard as important | to call into question, to doubt, to question
1084	896	sankou	さんこう	参考	 reference, consultation
1085	897	kawari	かわり	代わり	substitute, replacement, substituting, replacing | stand-in, proxy, alternate, deputy, relief, successor | compensation, exchange, return | another helping, second helping, seconds, refill | upcoming program, upcoming programme, がわり (代わり)  substitute for ...
1085	898	kanshin	かんしん	関心	 concern, interest
1087	899	tsuini	ついに	遂に	finally, at last | in the end, after all, never (happened)
1089	900	renraku	れんらく	連絡	contacting, (making) contact, getting in touch, communication, correspondence, call, message | connection (with a train, bus, etc.), joining (a railway line, etc.), meeting | connection (between matters, incidents, etc.), relation, link
