4629	3901	kokkyou	こっきょう	国境	 national border, provincial border
4629	3902	nagasaki	ながさき	長崎	 Nagasaki (city, prefecture)
4629	3903	miataru	みあたる	見当たる	 to be found
4634	3904	kekkan	けっかん	血管	 blood vessel, vein
4634	3905	fushi	ふし	節	occasion, time | section (of a literary work), paragraph, verse, stanza, passage | season, term, holiday | principle, integrity | node (of a plant stem) | clause | (taxonomical) section, ノット (節)  knot (nautical mile per hour), ふし (節) joint, knuckle | tune, melody | knot (in wood), node in a bamboo stem | part, notable characteristic, ぶし (節)  characteristic way of speaking, よ (節)  space between two nodes (on bamboo, etc.), せち (節) season, time of the year | seasonal festival | seasonal banquet, seasonal feast
4634	3906	hoikuen	ほいくえん	保育園	 nursery school, day nursery, preschool
4634	3907	min	みん	民	 people, citizens, subjects, folk, みん (民) citizen, resident, person | user (of a website, esp. as a collective, e.g. Twittersphere)
4638	3908	oyasumi	おやすみ	御休み	holiday, day off, absence | sleep, rest | Good night
4638	3909	kokutetsu	こくてつ	国鉄	 national railway (esp. former Japan National Railways)
4638	3910	kobamu	こばむ	拒む	to refuse, to reject, to decline | to prevent (from doing), to deny (e.g. access), to block
4638	3911	shikichi	しきち	敷地	 site, plot, lot, grounds
4645	3912	obieru	おびえる	怯える	 to become frightened, to be frightened (of), to be scared (of)
4645	3913	kenmei	けんめい	懸命	 eager, earnest, strenuous, fervent, assiduous, with utmost effort
4645	3914	kougi	こうぎ	講義	 lecture
4645	3915	miya	みや	宮	shrine | palace, imperial residence | Imperial prince, Imperial princess | headboard with built-in shelves, drawers, etc. | temple, きゅう (宮) palace | tonic (of the Japanese and Chinese pentatonic scale) | ancient Chinese punishment (castration for men, or confinement for women) | zodiacal sign
4650	3916	ima	いま	居間	 living room (Western style), sitting room
4651	3917	ijime	いじめ	苛め	 bullying, teasing
4652	3918	takumi	たくみ	巧み	 skillful, adroit, dexterous, masterful, clever, ingenious, cunning
4652	3919	futou	ふとう	不当	 injustice, impropriety, unreasonableness, undeserved, unfair, invalid
4654	3920	jissensuru	じっせんする	実践する	
4654	3921	senchakujun	せんちゃくじゅん	先着順	 order of arrival, first-come-first-served basis
4656	3922	joui	じょうい	上位	superior (in rank), top, ranking | higher order (e.g. byte) | host computer (of connected device)
4656	3923	sode	そで	袖	sleeve | wing (of a stage, desk, gate, etc.)
4659	3924	kansatsu	かんさつ	観察	 observation, survey, watching
4659	3925	gouin	ごういん	強引	 overbearing, coercive, pushy, forcible, high-handed
4659	3926	jushinsuru	じゅしんする	受診する	
4663	3927	oira	おいら	己等	we, us | I, me, うぬら (汝等) ye, you | me, I, us, we
4663	3928	shibou	しぼう	脂肪	 fat, grease, blubber, lard, suet
4663	3929	shokuseikatsu	しょくせいかつ	食生活	 eating habits
4663	3930	juwaki	じゅわき	受話器	 (telephone) receiver
4663	3931	tsukaru	つかる	浸かる	to be submerged, to be soaked | to be pickled, to be well seasoned | to be totally immersed (in a condition, e.g. laziness)
4669	3932	karasu	からす	烏	 crow (Corvus spp.), raven
4669	3933	kouza	こうざ	口座	 account (e.g. bank)
4669	3934	konnichi	こんにち	今日	today, this day | these days, recently, nowadays
4672	3935	atakamo	あたかも	恰も	as if, as it were, as though | right then, just then, at that moment
4672	3936	kyuuyo	きゅうよ	給与	pay, salary, wages | allowance, grant, supply, providing with
4672	3937	shimaru	しまる	締まる	to be shut, to close, to be closed | to be firm (of a body, face, etc.), to be well-knit | to be locked | to tighten, to be tightened | to become sober, to become tense
4672	3938	shinyuu	しんゆう	親友	 close friend, bosom (old, intimate) friend, buddy, crony, chum
4672	3939	tokurei	とくれい	特例	 special case, exception
4677	3940	ohiru	おひる	御昼	lunch | noon, midday | daytime | waking up, getting up, rising
4677	3941	kototou	こととう	事等	
4681	3942	tousaisuru	とうさいする	搭載する	
4681	3943	hikitsukeru	ひきつける	引き付ける	to attract, to draw near | to charm, to attract, to fascinate, to entice | to have a convulsion
4683	3944	enchou	えんちょう	延長	extension, elongation, prolongation, lengthening | Enchō era (923.4.11-931.4.26)
4683	3945	ouen	おうえん	応援	aid, assistance, help, support, reinforcement | cheering, rooting (for), support
4683	3946	oomune	おおむね	概ね	in general, generally, mostly, roughly, largely, mainly, on the whole, by and large | gist, point, main idea
4683	3947	kankoukyaku	かんこうきゃく	観光客	 tourist
4683	3948	gokyouryoku	ごきょうりょく	御協力	 cooperation, collaboration
4683	3949	samasu	さます	覚ます	to awaken, to arouse from sleep | to bring to one's senses, to disabuse (someone of) | to sober up | to dampen, to throw a damper on, to spoil
4683	3950	shingi	しんぎ	審議	 deliberation
4683	3951	tsubasa	つばさ	翼	wing | Chinese "Wings" constellation (one of the 28 mansions) | counter for birds or bird wings
4683	3952	fuseru	ふせる	伏せる	to turn over (face down), to lay face down, to lay upside down | to point downwards (eyes, head, etc.), to cast down (eyes) | to lie (one's body) face down, to lie flat (on the ground) | to conceal, to hide, to keep secret, to place in hiding (e.g. troops for an ambush) | to lie down, to retire, to go to bed (with an illness)
4683	3953	houkaisuru	ほうかいする	崩壊する	
4694	3954	ashioto	あしおと	足音	sound of footsteps | sense or sign that something is approaching
4694	3955	ichiin	いちいん	一員	 person, member
4694	3956	kagu	かぐ	家具	 furniture
4694	3957	ketsugi	けつぎ	決議	 resolution, vote, decision
4694	3958	hojokin	ほじょきん	補助金	 assistance payment, subsidiary aid
4700	3959	shinseisuru	しんせいする	申請する	
4701	3960	kuttsuku	くっつく	くっ付く	to adhere to, to stick to, to cling to | to keep close to, to go along with | to get involved with, to be thick with, to become intimate
4701	3961	tsubureru	つぶれる	潰れる	to be crushed, to be smashed, to be broken, to collapse | to become useless, to cease functioning, to be wasted (e.g. time) | to go bankrupt, to go out of business, to fail
4703	3962	kinshi	きんし	禁止	 prohibition, inhibition, ban
4703	3963	jikakusuru	じかくする	自覚する	
4703	3964	tasu	たす	足す	to add (numbers) | to add (something), to top up (with something) | to take care of (e.g. one's business)
4706	3965	chuusei	ちゅうせい	中世	 Middle Ages (in Japan esp. the Kamakura and Muromachi periods), medieval times, mediaeval times
4706	3966	nanimono	なにもの	何者	 who, what kind of person
4706	3967	yotte	よって	因って	 therefore, consequently, accordingly, for that reason
4710	3968	arasoi	あらそい	争い	 dispute, strife, quarrel, dissension, conflict, rivalry, contest
4710	3969	gendo	げんど	限度	 limit, bounds
4710	3970	juukyo	じゅうきょ	住居	dwelling, house, residence, address | living, life, じゅうきょ (住居)  dwelling, house, residence, address
4714	3971	shinraisuru	しんらいする	信頼する	
4715	3972	ryaku	りゃく	略	 almost, roughly, approximately, りゃく (略) abbreviation, omission | outline, gist | plan, strategy, scheme
4718	3973	iyagaru	いやがる	嫌がる	 to hate, to dislike
4718	3974	shisasuru	しさする	示唆する	
4718	3975	chiru	ちる	散る	to fall (e.g. blossoms, leaves) | to scatter, to be dispersed | to disappear, to dissolve, to break up | to spread, to run, to blur | to die a noble death
4721	3976	kakushinsuru	かくしんする	確信する	
4722	3977	utsusu	うつす	写す	to transcribe, to duplicate, to reproduce, to imitate, to trace | to describe | to film, to picture, to photograph
4722	3978	henshuu	へんしゅう	編集	 editing, compilation
4725	3979	kousou	こうそう	構想	 plan, plot, idea, conception, vision, scheme
4725	3980	tomadou	とまどう	戸惑う	 to be bewildered, to be perplexed
4728	3981	awai	あわい	淡い	 light, faint, pale, fleeting
4728	3982	shinjuku	しんじゅく	新宿	
4728	3983	haishi	はいし	廃止	 abolition, repeal
4731	3984	saranaru	さらなる	更なる	 even more, still more, further
4731	3985	shokudou	しょくどう	食堂	dining room, dining hall, cafeteria, canteen, messroom | restaurant, eatery, snack bar, diner, じきどう (食堂)  dining hall (at a temple)
4733	3986	gaka	がか	画家	 painter, artist
4733	3987	tsuri	つり	釣り	fishing, angling | change (for a purchase) | clickbaiting | trolling, writing deliberately inflammatory posts online
4733	3988	fumikomu	ふみこむ	踏み込む	to step into (e.g. someone else's territory), to break into, to raid | to come to grips with, to get to the core of
4737	3989	oba	おば	伯母	 aunt
4737	3990	shuryuu	しゅりゅう	主流	mainstream, commonplace | main course (of a river), main stream
4737	3991	tsukaeru	つかえる	仕える	 to serve, to work for, to attend
4737	3992	bi	び	美	 beauty, み (御) august | beautiful
4741	3993	jikkansuru	じっかんする	実感する	
4741	3994	yasashisa	やさしさ	優しさ	
4741	3995	yunyuusuru	ゆにゅうする	輸入する	
4746	3996	iseki	いせき	遺跡	 historic ruins (remains, relics), archeological site
4746	3997	kannen	かんねん	観念	idea, notion, concept, conception | sense (e.g. of duty) | resignation, preparedness, acceptance | observation and contemplation, meditation
4746	3998	kuiki	くいき	区域	limits, boundary, domain, zone, sphere, territory | area (e.g. in programming languages)
4746	3999	souryou	そうりょう	送料	 postage, carriage, shipping charge
4746	4000	choukiteki	ちょうきてき	長期的	 long-term
