7463	6201	ooshi	おおし	多し	
7463	6202	ki	き	黄	 yellow
7463	6203	touyo	とうよ	投与	 administration (of medicine)
7463	6204	yomi	よみ	読み	reading | reading (of a kanji, esp. kun reading) | reading (e.g. of a situation), insight, judgment, interpretation, prediction, calculation
7468	6205	kansou	かんそう	乾燥	dryness, aridity, drying (e.g. clothes), dehydration, desiccation | insipidity
7468	6206	kuyakusho	くやくしょ	区役所	 ward office, council (regional)
7468	6207	gunshuu	ぐんしゅう	群集	 crowd, community, group, herd, gathering, assembly
7468	6208	kouun	こううん	幸運	 good luck, fortune
7468	6209	shitsuryou	しつりょう	質量	 mass
7468	6210	jogai	じょがい	除外	 exception, exclusion
7468	6211	suichuu	すいちゅう	水中	 underwater
7468	6212	sonawaru	そなわる	備わる	to be furnished with, to be provided with, to be equipped with | to be possessed of, to be endowed with, to be gifted with | to be among, to be one of
7468	6213	tatakitsukeru	たたきつける	叩き付ける	to throw violently against, to slam against, to strike, to slap something onto, to dash (e.g. to the floor) | to thrust at someone (e.g. a letter)
7468	6214	chirashi	ちらし	散らし	scattering | leaflets | sushi rice in a box or bowl with a variety of ingredients sprinkled on top | writing in an irregular hand
7468	6215	fukikomu	ふきこむ	吹き込む	to blow into, to breathe into | to inspire, to indoctrinate | to record (music, video, etc.)
7468	6216	benpi	べんぴ	便秘	 constipation
7468	6217	muimi	むいみ	無意味	 nonsense, no meaning, meaningless
7482	6218	ichien	いちえん	一円	one yen | throughout (an area), whole district
7482	6219	eiyuu	えいゆう	英雄	hero, heroine, great person | Eroica Symphony (Beethoven, 1804) | Heroic Polonaise (Chopin)
7482	6220	kurushimeru	くるしめる	苦しめる	to torment, to pain, to inflict (physical) pain, to hurt | to harass, to cause (emotional) pain, to afflict, to distress, to bother, to trouble, to stump, to baffle
7482	6221	toujoujinbutsu	とうじょうじんぶつ	登場人物	 character (in a play or novel), dramatis personae
7482	6222	noufu	のうふ	納付	 payment, supply
7482	6223	hijuu	ひじゅう	比重	specific gravity, relative density | relative importance, weight
7482	6224	hosomeru	ほそめる	細める	 to make narrow
7482	6225	yakuzai	やくざい	薬剤	 medicine, drug, chemical
7491	6226	igamu	いがむ	歪む	to warp, to bend, to contort | to be perverted, to be warped (of a view, mind, etc.), to be distorted, to be cross-grained, ひずむ (歪む)  to warp, to become strained, to become distorted, to become crooked
7491	6227	ouyou	おうよう	応用	(practical) application, putting to practical use | applied
7491	6228	oshougatsu	おしょうがつ	御正月	New Year (esp. first three days) | first month of the year, January
7491	6229	kaitoru	かいとる	買い取る	 to buy, to purchase
7491	6230	kagon	かごん	過言	exaggeration, overstatement, saying too much | misstatement, slip of the tongue, gaffe
7491	6231	kutsuu	くつう	苦痛	 pain, agony, bitterness
7491	6232	kumo	くも	蜘蛛	 spider
7491	6233	shuku	しゅく	祝	congratulation, congratulations, celebration, festival | congratulatory gift, present, はふり (祝) junior Shinto priest | Shinto priest, generic title for a member of the Shinto priesthood, しゅく (祝) public holiday | celebration (of)
7491	6234	jisshitsu	じっしつ	実質	substance, essence | real (in economics, vs. nominal, e.g. real interest rate), substantive, substantial, essential, tangible
7491	6235	tantan	たんたん	淡々	uninterested, unconcerned, indifferent, dispassionate, matter-of-fact, detached | plain, light, simple, bland | flowing gently
7491	6236	nettou	ねっとう	熱湯	 boiling water, あつゆ (熱湯)  warmer than usual bath
7491	6237	fun	ふん	糞	shit, crap | pooh-pooh, poop, something dirty, くそ (糞) damn, damn it, shit, crap | feces, excrement, dung | damn, damned, blasted, stupid | very, extremely, really | terrible, awful, shit, crap | a lot | negligible, insignificant, not mattering at all, counting for nothing, hardly worth consideration, out of the question, ふん (糞)  feces (esp. animal), excrement, dung
7491	6238	mukou	むこう	無効	 invalid, void, ineffective, unavailable
7509	6239	ikinobiru	いきのびる	生き延びる	 to survive, to live long
7509	6240	ishikiteki	いしきてき	意識的	 conscious, deliberate, intentional
7509	6241	ichininmae	いちにんまえ	一人前	one portion, one serving, one person | adult, grown-up, person who has come of age | fully fledged, established, qualified
7509	6242	kikin	ききん	基金	 fund, foundation
7509	6243	shuugiin	しゅうぎいん	衆議院	 House of Representatives (lower house of the National Diet of Japan)
7509	6244	taisou	たいそう	体操	gymnastics, physical exercises | artistic gymnastics, gymnastics competition | physical education (class), PE
7509	6245	naisho	ないしょ	内緒	secrecy, confidentiality, privacy, secret | one's circumstances (esp. fiscal) | inner realization, personal enlightenment | kitchen
7509	6246	fuyukai	ふゆかい	不愉快	 unpleasant, disagreeable, displeasing, uncomfortable, unhappy
7509	6247	budou	ぶどう	葡萄	 grape, grapevine
7509	6248	honban	ほんばん	本番	performance, take, going before an audience or on-air | game, season, crucial moment | penetrative vaginal sex (with a prostitute), unsimulated sex (in an adult movie)
7509	6249	maiasa	まいあさ	毎朝	 every morning
7509	6250	yokuasa	よくあさ	翌朝	 next morning
7509	6251	riku	りく	陸	 satisfactory, decent, good, proper, worthy, りく (陸)  land, shore, ろく (六)  six
7522	6252	kagakubusshitsu	かがくぶっしつ	化学物質	 chemical substances, chemicals
7522	6253	samasu	さます	冷ます	to cool (e.g. from a high temperature to room temperature), to let cool | to dampen, to throw a damper on, to spoil
7522	6254	sosen	そせん	祖先	 ancestor
7522	6255	nikomu	にこむ	煮込む	to boil well, to stew, to simmer (for a long time) | to cook (various ingredients) together
7522	6256	nipponshu	にっぽんしゅ	日本酒	 sake, Japanese rice wine
7522	6257	hitsuyoujikou	ひつようじこう	必要事項	 necessary information, required fields (e.g. in a form)
7530	6258	omomuki	おもむき	趣	meaning, tenor, gist | effect, influence | appearance, aspect | grace, charm, refinement, taste, elegance
7530	6259	kaimen	かいめん	海面	 sea level, (surface of) sea
7530	6260	kamae	かまえ	構え	structure, construction, appearance | posture (e.g. in martial arts), pose, stance | readiness, determination, preparedness | kanji enclosure type radical (must enclose at least two sides of the kanji)
7530	6261	giwaku	ぎわく	疑惑	 doubt, misgivings, distrust, suspicion
7530	6262	zankoku	ざんこく	残酷	 cruel, brutal, ruthless, merciless, inhuman
7530	6263	senseikata	せんせいかた	先生方	 doctors, teachers
7530	6264	chosakuken	ちょさくけん	著作権	 copyright
7530	6265	tentou	てんとう	店頭	shopfront, storefront, shopwindow, (near the) shop entrance | over-the-counter
7530	6266	naokatsu	なおかつ	尚且つ	besides, furthermore, on top of that | and yet, nevertheless, even so
7539	6267	udetokei	うでとけい	腕時計	 wristwatch, watch
7539	6268	okureru	おくれる	送れる	
7539	6269	kitte	きって	切手	 stamp (postage), merchandise certificate, きれて (切れ手)  man of ability
7539	6270	shinro	しんろ	進路	route, course, path | one's future course (e.g. after graduating high school)
7539	6271	sourau	そうらう	候う	
7539	6272	taiji	たいじ	胎児	 fetus, foetus, embryo, unborn child
7539	6273	daimyou	だいみょう	大名	 daimyo (Japanese feudal lord)
7539	6274	tettei	てってい	徹底	thoroughness, completeness, consistency | thorough enforcement, seeing to it that a policy, etc. is carried out without exception
7539	6275	haritsuku	はりつく	張り付く	to stick (to), to cling (to) | to stay (e.g. in the office)
7539	6276	bannen	ばんねん	晩年	 one's later years, final years (in life)
7539	6277	heibon	へいぼん	平凡	 ordinary, common, commonplace, mediocre, unremarkable, undistinguished, uneventful
7539	6278	hoshou	ほしょう	保障	 guarantee, security, assurance, pledge, warranty
7555	6279	samayou	さまよう	さ迷う	 to loiter, to putter, to prowl, to wander about, to roam about, to knock around
7555	6280	shizumeru	しずめる	沈める	to sink (e.g. a ship), to submerge | to lower (e.g. one's body into a chair) | to floor (an opponent)
7555	6281	shokushu	しょくしゅ	職種	 type of occupation, occupational category
7555	6282	taku	たく	託	
7555	6283	fuzai	ふざい	不在	absence | disregard, indifference
7562	6284	oomaka	おおまか	大まか	rough (estimate, outline, etc.), broad, general, loose | generous, openhanded
7562	6285	sasae	ささえ	支え	 support, stay, prop, つかえ (痞え) load on one's chest | obstacle, hindrance, impediment, difficulty
7562	6286	torihikisaki	とりひきさき	取り引き先	 customer, client, client company, business connection, trade partner
7562	6287	nariyuki	なりゆき	成り行き	course (of events), development, progress, outcome, result | market order, order without limit
7562	6288	nanbu	なんぶ	南部	 southern part, the south (of a region)
7562	6289	hanron	はんろん	反論	 objection, refutation, rebuttal, counterargument
7562	6290	hikinuku	ひきぬく	引き抜く	to extract, to pull out, to draw out, to uproot | to headhunt, to lure away, to poach, to entice
7562	6291	fumikiru	ふみきる	踏み切る	to take off, to jump, to leap | to take the plunge, to decide, to embark on, to venture into, to launch out into | to step out of the ring
7562	6292	hourensou	ほうれんそう	菠薐草	 spinach
7572	6293	isshoukenmei	いっしょうけんめい	一生懸命	 very hard, with utmost effort, with all one's might, for dear life
7572	6294	shinraidekiru	しんらいできる	信頼出来る	
7575	6295	okata	おかた	御方	friend, ally, supporter | taking sides with, supporting, standing by, backing up, おかた (御方)  this lady or gentleman
7575	6296	kyuuden	きゅうでん	宮殿	 palace
7575	6297	sashimi	さしみ	刺し身	 sashimi (raw sliced fish, shellfish or crustaceans)
7575	6298	jizoku	じぞく	持続	 continuation, persisting, lasting, sustaining, enduring
7575	6299	takahashi	たかはし	高橋	
7575	6300	nanjikan	なんじかん	何時間	 how many hours?
