8435	7001	ippen	いっぺん	一変	 complete change, about-face
8435	7002	onozuto	おのずと	自ずと	 naturally, in due course, by itself, of its own accord
8435	7003	genbun	げんぶん	原文	 original text
8435	7004	koizumishushou	こいずみしゅしょう	小泉首相	
8435	7005	tachiiru	たちいる	立ち入る	to enter, to trespass | to interfere, to meddle, to pry into
8435	7006	tsukisou	つきそう	付き添う	 to attend on, to wait on, to accompany, to escort, to chaperone
8435	7007	hyougendekiru	ひょうげんできる	表現出来る	
8435	7008	henshin	へんしん	変身	 metamorphosis, disguise, transformation, shapeshifting, morphing
8435	7009	magire	まぎれ	紛れ	 fluke, chance, pure luck, まぎれ (紛れ) confusion, complications | being gripped by strong feelings, fit (e.g. of anger), moment (e.g. of frustration)
8435	7010	maguro	まぐろ	鮪	tuna (edible fish, Thunnus spp.), tunny | Pacific bluefin tuna (edible fish, Thunnus orientalis) | dead lay, starfish, person who is inactive during sexual intercourse
8435	7011	yamu	やむ	病む	to fall ill | to suffer from (e.g. a disease), to have something wrong with (e.g. an inner organ)
8447	7012	atari	あたり	当たり	hit | success | guess, prediction | affability, friendliness | sensation, touch | bruise (on fruit) | situation in which a stone or chain of stones may be captured on the next move (in the game of go) | bite (of a fish on a hook), strike | per, each
8447	7013	okureru	おくれる	御呉れる	
8447	7014	tousen	とうせん	当選	being elected | being selected (to win a prize, etc.) | winning (in a lottery, raffle, etc.)
8447	7015	touron	とうろん	討論	 debate, discussion
8447	7016	murasakiiro	むらさきいろ	紫色	 purple, violet
8447	7017	yure	ゆれ	揺れ	shaking, shake, jolt, jolting, vibration, tremor, flickering | unsettledness, instability, vacillating, wavering | existence of multiple spellings, pronunciations, usages, etc. for a single word
8447	7018	youchuui	ようちゅうい	要注意	 need for caution, need for care, requiring special attention
8457	7019	ohaka	おはか	御墓	 imperial tomb
8457	7020	kaitousha	かいとうしゃ	回答者	 respondent
8457	7021	kaku	かく	角	angle | square, cube | bishop | third degree (of the Japanese and Chinese pentatonic scale) | Chinese "horn" constellation (one of the 28 mansions) | jiao (monetary unit of China; one-tenth of a yuan), かど (角) corner, edge | (street) corner, turning | rough edges (of one's character, words, etc.), abrasiveness, harshness, sharpness, つの (角) horn, antler | antenna, feeler, tentacle (e.g. of a snail) | horn-like projection (e.g. peaks of whipped cream), すみ (隅) corner, nook, recess | downstage right (on a noh stage)
8457	7022	gakureki	がくれき	学歴	 academic background
8457	7023	kyouzai	きょうざい	教材	 teaching materials
8457	7024	kokuminkenkouhoken	こくみんけんこうほけん	国民健康保険	 national health insurance
8457	7025	goutou	ごうとう	強盗	robber, mugger | robbery, burglary
8457	7026	shousetsuka	しょうせつか	小説家	 novelist, fiction writer
8457	7027	shoka	しょか	初夏	early summer | fourth month of the lunar calendar
8457	7028	ji	じ	時	time, hour, moment | occasion, case | chance, opportunity, season | the times, the age, the day | tense, じ (時) hour, o'clock | (specified) time, when ..., during ..., どき (時) time for ..., time to ..., good opportunity to ... | season
8457	7029	sushi	すし	寿司	 sushi, anything made with vinegared rice (may also contain vegetables, spices, fish, or other delicacies)
8457	7030	sokoku	そこく	祖国	 motherland, fatherland, native country
8457	7031	tousan	とうさん	倒産	 (corporate) bankruptcy, insolvency, commercial failure, failed business
8457	7032	hazure	はずれ	外れ	end, verge, extremity, tip, outskirts | miss, failure, blank (e.g. lottery ticket)
8457	7033	fukeru	ふける	耽る	to indulge in, to give oneself up to, to be obsessed by | to be engrossed in, to be lost in, to be absorbed in
8457	7034	hensei	へんせい	編成	 composition, formation, organization, organisation, compilation
8457	7035	horeru	ほれる	惚れる	 to fall in love, to be in love, to be charmed with, to lose one's heart to
8478	7036	ikkaime	いっかいめ	一回目	
8478	7037	okotae	おこたえ	御答え	
8478	7038	otsukiai	おつきあい	御付き合い	 association, socializing, socialising, fellowship
8478	7039	omutsu	おむつ	御襁褓	 diaper, nappy, napkin
8478	7040	kazei	かぜい	課税	 taxation
8478	7041	shoshiki	しょしき	書式	 prescribed form (of writing), format
8478	7042	senzaiteki	せんざいてき	潜在的	 latent, potential
8478	7043	denshou	でんしょう	伝承	 handing down (information), legend, tradition, folklore, transmission
8478	7044	habuku	はぶく	省く	to omit, to leave out, to exclude, to eliminate | to curtail, to save, to cut down, to economize, to economise
8478	7045	burasagaru	ぶらさがる	ぶら下がる	 to hang from, to dangle, to swing
8478	7046	yake	やけ	焼け	 desperation, despair, self-abandonment
8490	7047	ishigaki	いしがき	石垣	 stone wall
8490	7048	ichinichijuu	いちにちじゅう	一日中	 all day long, all the day, throughout the day
8490	7049	oiru	おいる	老いる	 to age, to grow old
8490	7050	kankokujin	かんこくじん	韓国人	 South Korean person
8490	7051	gyouseikikan	ぎょうせいきかん	行政機関	 administrative organ, administrative body
8490	7052	gen	げん	言	 word, remark, statement
8490	7053	takara	たから	宝	 treasure
8490	7054	tono	との	殿	rear, rear unit guard | anchor (man), との (殿) feudal lord | mansion, palace, どの (殿)  Mr., Mrs., Miss, Ms.
8490	7055	hachimitsu	はちみつ	蜂蜜	 honey
8490	7056	houmen	ほうめん	方面	direction, district, area | field (e.g. of study), sphere, quarter, aspect, angle
8490	7057	mitsudo	みつど	密度	 density
8490	7058	yoki	よき	予期	 expectation, assume will happen, forecast
8490	7059	ryokou	りょこう	旅行	 travel, trip, journey, excursion, tour
8504	7060	omowaku	おもわく	思惑	expectation, anticipation, prediction, forecast, calculations | purpose, intention, motive, ulterior motive | others' opinions of one | speculation, しわく (思惑)  perceptive mental disturbances
8504	7061	gogen	ごげん	語源	 origin of a word, derivation of a word, etymology
8504	7062	shoudaku	しょうだく	承諾	 consent, approval, acceptance, agreement, compliance
8504	7063	juutai	じゅうたい	渋滞	 congestion (e.g. traffic), delay, stagnation
8504	7064	jouhouka	じょうほうか	情報化	 computerization, computerisation
8504	7065	tayouka	たようか	多様化	 diversification
8504	7066	tsuriageru	つりあげる	吊り上げる	to raise, to lift, to hang up, to suspend | to raise prices (artificially, deliberately)
8504	7067	nomihosu	のみほす	飲み干す	 to drink up, to drain (cup)
8504	7068	hitomae	ひとまえ	人前	 portion of food, ひとまえ (人前)  presence of other people, (in) public, (in) front of others
8504	7069	bunsan	ぶんさん	分散	dispersion, breakup, scattering, decentralization, decentralisation, distribution | variance | dispersion
8504	7070	heikinchi	へいきんち	平均値	 average value, mean value, mean, expectation
8504	7071	ronten	ろんてん	論点	 point in question (at issue)
8518	7072	ussura	うっすら	薄ら	 slightly, lightly, thinly, faintly, dimly, うすら (薄ら)  slight, light, thin, faint, dim
8518	7073	utsu	うつ	鬱	depression, low spirits | luxuriant (of vegetation)
8518	7074	eisei	えいせい	衛星	(natural) satellite, moon | (artificial) satellite
8518	7075	omoiataru	おもいあたる	思い当たる	 to suddenly understand (esp. on basis of experience or memory), to come to mind, to recall (in a flash), to be reminded of, to call to mind, to think of, to strike on, to hit on an answer, to seize the crux of a problem
8518	7076	kaimei	かいめい	解明	 elucidation, explication, explaining, unravelling, clarification, understanding
8518	7077	kachiku	かちく	家畜	 domestic animals, livestock, cattle
8518	7078	kenkyuuhi	けんきゅうひ	研究費	 research funds (expenses)
8518	7079	kouhosha	こうほしゃ	候補者	 candidate, applicant
8518	7080	shishunki	ししゅんき	思春期	 puberty, adolescence
8518	7081	jumon	じゅもん	呪文	 spell, charm, incantation, magic word
8518	7082	sube	すべ	術	art, technique | means, way | trick, trap, plot, stratagem | magic, すべ (術)  way, method, means
8518	7083	taika	たいか	対価	 compensation, equivalent value, consideration
8518	7084	hiiteha	ひいては	延いては	 not only ... but also, in addition to, consequently
8518	7085	bunmyaku	ぶんみゃく	文脈	context (of a passage), line of thought | context, environment, circumstances
8518	7086	manshuu	まんしゅう	満州	 Manchuria
8535	7087	kessaku	けっさく	傑作	masterpiece, best work | amusing blunder, funny mistake, boner
8535	7088	kouseiroudoudaijin	こうせいろうどうだいじん	厚生労働大臣	 Minister of Health, Labour and Welfare
8535	7089	konseki	こんせき	痕跡	 trace, vestige, mark, sign, evidence
8535	7090	sao	さお	竿	rod, pole | neck (of a shamisen, etc.), shamisen | beam (i.e. the crossbar of a balance) | single line (esp. as a flying formation for geese) | penis | counter for flags (on poles), counter for long, thin Japanese sweets (e.g. yōkan), かん (竿)  counter for poles, rods, etc.
8535	7091	shozai	しょざい	所在	 whereabouts, place where one is, position, location
8535	7092	dentatsu	でんたつ	伝達	 transmission (e.g. news, chemical signals, electricity), communication, delivery, conveyance, transfer, relay, propagation, conduction
8535	7093	haiken	はいけん	拝見	 seeing, looking at
8535	7094	hitteki	ひってき	匹敵	 to be a match for, to rival, to equal, to compare with, to be equivalent to
8535	7095	hitsuyouijou	ひつよういじょう	必要以上	
8546	7096	itchi	いっち	一致	coincidence, agreement, union, match | conformity, consistency | cooperation
8546	7097	kakuhodekiru	かくほできる	確保出来る	
8546	7098	kansenshou	かんせんしょう	感染症	 infectious disease, infection
8546	7099	kyougi	きょうぎ	競技	 game, match, contest
8546	7100	kouseibusshitsu	こうせいぶっしつ	抗生物質	 antibiotic, antibiotics
