7929	6601	nakaba	なかば	半ば	middle, halfway, midway | half (of), one half | half (e.g. done, jokingly), partly, in part, partially | mostly, almost, nearly
7929	6602	nendo	ねんど	年度	fiscal year (usu. April 1 to March 31 in Japan), financial year | academic year, school year | product year
7929	6603	hakaru	はかる	諮る	 to consult with, to discuss, to confer, to deliberate
7929	6604	honshin	ほんしん	本心	true feelings, real intention, one's heart | one's right mind, one's senses, one's conscience
7942	6605	umarekawaru	うまれかわる	生まれ変わる	 to be born again, to make a fresh start in life
7942	6606	undou	うんどう	運動	exercise, physical training, work-out | appeal, campaign, drive, crusade, movement, lobbying | motion, movement
7942	6607	kagoshima	かごしま	鹿児島	 Kagoshima (city, prefecture)
7942	6608	kesshou	けっしょう	決勝	 decision of a contest, finals (in sports)
7942	6609	ketchaku	けっちゃく	決着	 conclusion, decision, end, settlement
7942	6610	shosai	しょさい	書斎	 study, library, den, home office, reading room
7942	6611	nezuyoi	ねづよい	根強い	 firmly rooted, deep-seated
7942	6612	hakusai	はくさい	白菜	 napa cabbage (Brassica rapa subsp. pekinensis), nappa cabbage, Chinese cabbage, パクチョイ (白菜)  bok choy (Brassica rapa subsp. chinensis; esp. cultivars with white stalks), pak choi, Chinese cabbage
7942	6613	haramu	はらむ	孕む	to conceive, to become pregnant | to get filled with (e.g. sails filled with wind), to be swollen with | to contain (a contradiction, danger, etc.), to carry (a problem, consequences, etc.), to involve (e.g. risk) | to be swollen and ripe (of a plant ear, head, sprout, etc.)
7942	6614	handandekiru	はんだんできる	判断出来る	
7942	6615	fumiireru	ふみいれる	踏み入れる	 to walk in on, to tread upon
7942	6616	honnou	ほんのう	本能	 instinct
7942	6617	raku	らく	楽	comfort, ease, relief, (at) peace, relaxation | easy, simple, without trouble, without hardships | (economically) comfortable | raku pottery | sukha (happiness), がく (楽) music | old Japanese court music, gagaku
7958	6618	kaishuu	かいしゅう	回収	 collection, recovery, withdrawal, retrieval
7958	6619	koritsu	こりつ	孤立	 isolation, being alone, being friendless
7958	6620	jihatsuteki	じはつてき	自発的	 spontaneous, voluntary
7958	6621	douyou	どうよう	動揺	shaking, trembling, pitching, rolling, oscillation | disturbance, unrest, agitation, excitement, commotion, turmoil, discomposure, feeling shaken
7958	6622	mukyuu	むきゅう	無休	 without a holiday, nonstop
7958	6623	yugami	ゆがみ	歪み	strain, deformation, warp, distortion | harmful effects, strain, stress, imbalance, ゆがみ (歪み) contortion, distortion, warp, bend, skew | kink (in one's character), twist
7958	6624	yobousesshu	よぼうせっしゅ	予防接種	 vaccination, inoculation, immunization, immunisation
7958	6625	rouba	ろうば	老婆	 old woman
7969	6626	en'en	えんえん	延々	forever, endlessly, on and on | meandering, wandering, winding, sinuous, serpentine, zigzagging
7969	6627	kyuushoku	きゅうしょく	給食	 provision of lunch (e.g. at office, school, etc.), providing a meal, lunch service
7969	6628	kuraseru	くらせる	暮らせる	
7969	6629	kengaku	けんがく	見学	 inspection, study by observation, field trip, tour, review
7969	6630	jiriki	じりき	自力	one's own strength, one's own efforts | self-salvation
7969	6631	tachimukau	たちむかう	立ち向かう	 to fight against, to oppose, to face
7969	6632	chijimeru	ちぢめる	縮める	to shorten, to reduce, to condense, to shrink | to crumple (fabric), to wrinkle | to make (one's body) smaller, to draw in (one's legs), to duck (one's head)
7969	6633	tetsu	てっ	徹	
7969	6634	hikoku	ひこく	被告	 defendant, the accused
7969	6635	furin	ふりん	不倫	 adultery, immorality, impropriety, (an) affair
7981	6636	kaisou	かいそう	階層	 class, level, stratum, layer, hierarchy
7981	6637	koushou	こうしょう	交渉	negotiations, discussions | connection
7981	6638	shikiru	しきる	仕切る	to partition, to divide, to mark off | to direct, to manage, to run, to organize, to take responsibility for | to settle accounts | to assume a crouching posture (at the start of a bout), to poise oneself for the initial charge
7981	6639	jitsugendekiru	じつげんできる	実現出来る	
7981	6640	zen'i	ぜんい	善意	virtuous mind | good intentions, good will | positive mindset | bona fides, good faith
7981	6641	taryou	たりょう	多量	 large quantity, large amount
7981	6642	chuuko	ちゅうこ	中古	used, second-hand, old | Middle Ages (in Japan esp. Heian period)
7981	6643	chomei	ちょめい	著名	 well-known, noted, celebrated
7981	6644	nissuu	にっすう	日数	 a number of days
7981	6645	higoro	ひごろ	日頃	 normally, habitually
7981	6646	heishitachi	へいしたち	兵士達	
7981	6647	yushutsu	ゆしゅつ	輸出	export, exportation | efferent
7981	6648	rijichou	りじちょう	理事長	 board chairman
7981	6649	wara	わら	藁	 straw
7998	6650	kaeru	かえる	蛙	frog | kajika frog (Buergeria buergeri)
7998	6651	kata	かた	方	direction, way | person, lady, gentleman | method of, manner of, way of | care of ... | person in charge of ... | side (e.g. "on my mother's side"), ほう (方) direction, way, side, area (in a particular direction) | side (of an argument, etc.), one's part | type, category | field (of study, etc.) | indicates one side of a comparison | way, method, manner, means | length (of each side of a square), さま (様) Mr., Mrs., Miss, Ms. | makes a word more polite (usu. in fixed expressions) | state, situation, appearance, manner, がた (方) Sirs, Mesdames | around (the time that, etc.), about, へ (辺) surrounding area | shore (of the sea) | suffix used as a rough indicator of location, direction, time, etc.
7998	6652	kudaku	くだく	砕く	 to break, to smash
7998	6653	kenshou	けんしょう	検証	 verification, inspection
7998	6654	taishoku	たいしょく	退職	 retirement, resignation
7998	6655	tatemae	たてまえ	建て前	face, official stance, public position or attitude (as opposed to private thoughts) | ceremony for the erection of the framework of a house
7998	6656	tesuri	てすり	手摺	 handrail, railing, banister
7998	6657	hikiage	ひきあげ	引き上げ	pulling up, drawing up, salvage, re-flotation | raising, increase, upward revision | repatriation, evacuation
7998	6658	hoikusho	ほいくしょ	保育所	 nursery school, nursery
8010	6659	aiso	あいそ	愛想	amiability, friendliness, affability, sociability | fondness (of someone), affection, liking | compliments, civilities, courtesies, flattery | hospitality, special treatment, entertainment | bill (at a restaurant), check
8010	6660	keigen	けいげん	軽減	 abatement, reduction
8010	6661	shokan	しょかん	書簡	 letter, note, epistle, correspondence
8010	6662	jigyoushu	じぎょうしゅ	事業主	 business owner, entrepreneur
8010	6663	juutan	じゅうたん	絨毯	 carpet, rug, runner
8010	6664	setsudan	せつだん	切断	 cutting, severance, section, amputation, disconnection
8010	6665	tsumasaki	つまさき	爪先	 toes, tips of the toes, toe of a shoe, sock, etc.
8010	6666	fuhenteki	ふへんてき	普遍的	 universal, omnipresent, ubiquitous
8010	6667	yoake	よあけ	夜明け	 dawn, daybreak
8010	6668	yokobai	よこばい	横這い	sidewise crawl (e.g. of a crab), crawling sideways | leafhopper (insect), jassid | sidewinder (Crotalus cerastes) | levelling off (of prices, etc.), stabilizing
8010	6669	ryou	りょう	寮	hostel, dormitory | bureau (government department beneath a ministry under the ritsuryo system) | tea-ceremony room | villa, つかさ (官) office, official | chief, head | (Yaeyama Islands in Okinawa) person (usually a woman) whose duty it is to officiate at religions ceremonies
8026	6670	akushitsu	あくしつ	悪質	malicious, vicious, malignant, underhanded | shoddy, inferior, poor-quality, second-rate
8026	6671	o	お	御	honorific, polite, humble prefix | honorific suffix, ぎょ (御) honorific affix | honorific prefix, み (御) august | beautiful, おおみ (大御)  august (in ref. to the emperor or the gods), imperial, divine, お (御)  honorific, polite, humble prefix
8026	6672	kanrijin	かんりじん	管理人	administrator, janitor, manager, concierge, caretaker, superintendent, supervisor | custodian, executor
8026	6673	ketsumatsu	けつまつ	結末	 end, conclusion
8026	6674	chuumokusu	ちゅうもくす	注目す	
8026	6675	tegata	てがた	手形	draft, draught, promissory note, bill | handprint | signed hand-print
8026	6676	nippon'ichi	にっぽんいち	日本一	 Japan's best, number one in Japan
8035	6677	kojin	こじん	故人	 the deceased, the departed
8035	6678	sadaka	さだか	定か	 definite, sure
8035	6679	jika	じか	直	straight | ordinary, common | doing nothing, ひた (直)  earnestly, immediately, exactly, じき (直) soon, in a moment, before long, shortly | nearby, close | direct | spot transaction, cash transaction, ちょく (直) direct, in person, frankness, honesty, simplicity, cheerfulness, correctness, being straight | night duty, shift (e.g. in a factory), あたい (直)  Atai (post-Taika hereditary title often given to regional administrators), じか (直)  direct, ただ (直)  straight, direct, ね (値) price, cost | value, worth, merit
8035	6680	chokusetsu	ちょくせつ	直接	 direct, immediate, personal, firsthand
8035	6681	hikigane	ひきがね	引き金	trigger (of a gun, etc.) | trigger (for something), immediate cause
8035	6682	himan	ひまん	肥満	 corpulence, fatness, obesity
8043	6683	ikubun	いくぶん	幾分	somewhat, to some extent, to some degree | some, part, portion
8043	6684	ittan	いったん	一端	one end, an end | part, fragment, いっぱし (一端)  fully fledged, full-fledged, proper, competent, qualified, full-grown
8043	6685	kawara	かわら	川原	 dry riverbed, river beach
8043	6686	kinmitsu	きんみつ	緊密	 rigour, rigor, closeness, compactness, tightly knit
8043	6687	hiruma	ひるま	昼間	 daytime, during the day, time from sunrise until sunset, diurnal period
8043	6688	hossa	ほっさ	発作	 fit, spasm, attack, seizure
8043	6689	yopparau	よっぱらう	酔っ払う	 to get drunk
8043	6690	wakate	わかて	若手	 young person
8051	6691	aojiroi	あおじろい	青白い	pale, pallid | bluish-white
8051	6692	atehameru	あてはめる	当て嵌める	 to apply, to adapt
8051	6693	igo	いご	以後	after this, from now on, hereafter | thereafter, since (then), after
8051	6694	shigaisen	しがいせん	紫外線	 ultraviolet rays, ultraviolet radiation
8051	6695	shimijimi	しみじみ	染み染み	keenly, deeply, fully, heartily, seriously, earnestly | calmly, quietly, softly | fixedly (e.g. gazing, staring)
8051	6696	nishidoitsu	にしどいつ	西ドイツ	 West Germany (1949-1990), Federal Republic of Germany
8051	6697	noukyou	のうきょう	農協	 agricultural cooperative
8051	6698	yobou	よぼう	予防	 prevention, precaution, protection against
8062	6699	owakaru	おわかる	御分かる	
8062	6700	kibishisa	きびしさ	厳しさ	 severity, strictness, intensity
