9435	7801	ikkensuru	いっけんする	一見する	
9435	7802	okanemochi	おかねもち	御金持ち	
9435	7803	okotaemoushiageru	おこたえもうしあげる	御答え申し上げる	
9435	7804	ora	おら	己	oneself (itself, etc.) | I, me | you | by oneself (itself, etc.) | interjection expressing anger or chagrin, おれ (俺)  I, me, き (己)  6th in rank, sixth sign of the Chinese calendar, うぬ (汝)  blockhead!, you, おら (己)  I, me, おどれ (己)  you, な (己) I | you, おの (己) oneself, myself | I | you
9435	7805	kueru	くえる	食える	
9435	7806	keikasochi	けいかそち	経過措置	 transitional measures
9435	7807	zengaku	ぜんがく	全額	 total, full amount, sum
9435	7808	soushoku	そうしょく	装飾	 ornament, decoration
9435	7809	taikei	たいけい	体型	figure, body shape, build, physique, form | somatotype, biotype, habitus, (type of) physique
9435	7810	tayasui	たやすい	容易い	 easy, simple, light
9435	7811	chihou	ちほう	痴呆	 dementia
9435	7812	nichigin	にちぎん	日銀	 Bank of Japan, BOJ, BoJ
9435	7813	hatsutaimen	はつたいめん	初対面	 first meeting, first interview with
9435	7814	hondana	ほんだな	本棚	 bookshelves, bookshelf, bookcase
9435	7815	manzokudekiru	まんぞくできる	満足出来る	
9435	7816	momeru	もめる	揉める	 to disagree, to dispute, to fight (over)
9435	7817	youtsuu	ようつう	腰痛	 lower back (or hip) pain, lumbago
9435	7818	yosougai	よそうがい	予想外	 unexpected, unforeseen, strange
9458	7819	azukaru	あずかる	与る	to participate in, to take part in, to play a part in | to receive, to be given, to enjoy
9458	7820	anshindekiru	あんしんできる	安心出来る	
9458	7821	itatte	いたって	至って	 very much, exceedingly, extremely
9458	7822	onozukara	おのずから	自ずから	 naturally, in due course, by itself, of its own accord
9458	7823	kougou	こうごう	皇后	 (Japanese) empress, queen
9458	7824	saiken	さいけん	債券	 bond, debenture
9458	7825	saabisugyou	さーびすぎょう	サービス業	 service industry, service sector
9458	7826	shuushi	しゅうし	終始	beginning and end | doing something from beginning to end, being unchanged from beginning to end | from beginning to end, the whole time, throughout, consistently
9458	7827	shuuyakusuru	しゅうやくする	集約する	
9458	7828	susume	すすめ	勧め	 recommendation, advice, suggestion, encouragement
9458	7829	soumudaijin	そうむだいじん	総務大臣	 Minister of Internal Affairs and Communications
9458	7830	sotsugyoushiki	そつぎょうしき	卒業式	 graduation ceremony, commencement
9458	7831	chikyuuondanka	ちきゅうおんだんか	地球温暖化	 global warming
9458	7832	teimei	ていめい	低迷	 hanging low (over), hovering around (price level), low hanging (e.g. clouds), sluggish (e.g. economy), slump, recession
9458	7833	tenrankai	てんらんかい	展覧会	 exhibition
9458	7834	nyuuyoku	にゅうよく	入浴	bathing | to bathe, to take a bath, to enter a bath
9458	7835	hendousuru	へんどうする	変動する	
9458	7836	yamaguchi	やまぐち	山口	 Yamaguchi (city, prefecture)
9458	7837	yomiageru	よみあげる	読み上げる	to read out, to read aloud, to call out | to finish reading, to read through
9483	7838	ichibubun	いちぶぶん	一部分	 one part, one portion, one section
9483	7839	kimete	きめて	決め手	decider, person who decides | deciding factor, clincher, trump card, winning move
9483	7840	kyousu	きょうす	供す	to offer, to present, to submit, to supply | to serve (food and drink) | to offer (to the gods), to set up (before an alter)
9483	7841	kyouchi	きょうち	境地	state (of mind), mental state, emotional condition | field (of activity) | one's lot, circumstance, situation in life | place, region, area, land
9483	7842	kyoutsuuten	きょうつうてん	共通点	 point in common, common feature
9483	7843	kuttsukeru	くっつける	くっ付ける	to attach, to stick together, to paste, to glue | to place together, to put side-by-side | to make someone get married, to get someone hitched
9483	7844	shusaisuru	しゅさいする	主催する	
9483	7845	shinbunkisha	しんぶんきしゃ	新聞記者	 newspaper reporter, print journalist
9483	7846	juutakuchi	じゅうたくち	住宅地	 housing district, residential district
9483	7847	seisokusuru	せいそくする	生息する	
9483	7848	senshuu	せんしゅう	先週	 last week, the week before
9483	7849	soru	そる	反る	to warp, to curve, to arch, to bend | to bend backward (body or body part, e.g. fingers), かえる (返る) to return, to come back, to go back | to turn over | to become extremely, to become completely
9483	7850	tanomi	たのみ	頼み	request, favor, favour | reliance, dependence, trust, hope, だのみ (頼み)  depending on, dependent upon, relying on
9483	7851	hatsuonsuru	はつおんする	発音する	
9483	7852	butsudan	ぶつだん	仏壇	 Buddhist (household) altar
9483	7853	makuramoto	まくらもと	枕元	 bedside, near one's pillow
9483	7854	mebaeru	めばえる	芽生える	 to bud, to sprout
9483	7855	ryakusu	りゃくす	略す	to abbreviate, to omit | to take, to capture
9483	7856	ryuugakusei	りゅうがくせい	留学生	 overseas student, exchange student
9483	7857	washira	わしら	わし等	
9505	7858	kasumeru	かすめる	掠める	to steal, to rob, to snatch, to pocket, to plunder | to deceive, to trick, to cheat | to graze (in passing), to skim, to brush against, to touch lightly | to appear and quickly disappear (a thought, a smile, etc.), to flit (through one's mind, across one's face) | to do (something) while no one is looking | to hint at, to suggest, to insinuate
9505	7859	shourisuru	しょうりする	勝利する	
9505	7860	shinbunshi	しんぶんし	新聞紙	newsprint, newspaper used for wrapping, packing, etc. | newspaper
9505	7861	jigyoukeikaku	じぎょうけいかく	事業計画	 business plan, business schedule, project
9505	7862	jishou	じしょう	事象	 event, phenomenon, matter
9505	7863	chika	ちか	地価	 the price of land
9505	7864	bangohan	ばんごはん	晩御飯	 dinner, evening meal
9505	7865	hikkurikaeru	ひっくりかえる	引っ繰り返る	to be overturned, to be reversed, to turn over, to capsize | to fall down, to tumble down, to topple over, to lie on one's back
9519	7866	okugai	おくがい	屋外	 outdoors, outside, やど (屋前)  outside near the door to one's home
9519	7867	oshiire	おしいれ	押し入れ	 closet
9519	7868	kakusuru	かくする	斯くする	
9519	7869	kanchigai	かんちがい	勘違い	 misunderstanding, mistaken idea, wrong guess
9519	7870	kikite	ききて	聞き手	hearer, listener, audience | interviewer, questioner
9519	7871	kyouguu	きょうぐう	境遇	 one's circumstances, environment, situation (in life)
9519	7872	koushiki	こうしき	公式	official, formal | formula (e.g. mathematical) | official (social media) account (of a company, organization, etc.)
9519	7873	shouji	しょうじ	障子	 shoji (paper sliding door)
9519	7874	seisou	せいそう	清掃	 cleaning, clean-up, garbage collection, scavenging
9519	7875	sebone	せぼね	背骨	 spine, backbone, spinal column
9519	7876	matsuge	まつげ	睫	 eyelashes
9533	7877	ikitodoku	いきとどく	行き届く	 to be scrupulous, to be attentive, to be prudent, to be complete, to be thorough
9533	7878	osensuru	おせんする	汚染する	
9533	7879	omaera	おまえら	御前等	 you (plural)
9533	7880	omoiukabu	おもいうかぶ	思い浮かぶ	 to occur to, to remind of, to come to mind
9533	7881	kagaku	かがく	価額	 valuation, amount
9533	7882	kariirekin	かりいれきん	借り入れ金	 loan, loan payable, debt
9533	7883	shin'i	しんい	真意	 real intention, true motive, true meaning
9533	7884	juutakuroon	じゅうたくろーん	住宅ローン	 housing loan, mortgage
9533	7885	taibetsusuru	たいべつする	大別する	
9533	7886	hyoukisuru	ひょうきする	表記する	
9533	7887	henkansuru	へんかんする	返還する	
9533	7888	manatsu	まなつ	真夏	 midsummer
9547	7889	koisuru	こいする	恋する	 to fall in love with, to love
9547	7890	kouki	こうき	後期	 latter period, second half, late stage, third trimester, second semester
9547	7891	koumyou	こうみょう	巧妙	 ingenious, skillful, clever, deft
9547	7892	gosoudankudasaru	ごそうだんくださる	御相談下さる	
9547	7893	saiteigen	さいていげん	最低限	minimum | at the very least
9547	7894	seigyosuru	せいぎょする	制御する	
9547	7895	zoushin	ぞうしん	増進	 promoting, increase, advance
9547	7896	tsugumu	つぐむ	噤む	 to shut one's mouth, to hold one's tongue, to keep silent
9547	7897	narita	なりた	成田	
9547	7898	haoru	はおる	羽織る	 to put on (coat, gown, etc.)
9547	7899	hanashihajimeru	はなしはじめる	話し始める	 to begin to speak
9561	7900	sumizumi	すみずみ	隅々	 every corner, every nook and cranny, all the ins and outs
