18047	14701	shissou	しっそう	疾走	 sprint, dash, scampering
18047	14702	shihoushoshi	しほうしょし	司法書士	 judicial scrivener, judicial clerk, person qualified to prepare legal documents, handle real-estate transactions, etc.
18047	14703	shashinsatsuei	しゃしんさつえい	写真撮影	 photography, taking photographs
18047	14704	shuushifu	しゅうしふ	終止符	full stop, period | end
18047	14705	shouchuugakkou	しょうちゅうがっこう	小中学校	 elementary and middle schools
18047	14706	shouhei	しょうへい	将兵	 officers and men
18047	14707	shouheki	しょうへき	障壁	enclosing wall, boundary fence | obstacle, barrier
18047	14708	shokudou	しょくどう	食道	 esophagus, gullet, esophageal
18047	14709	shinchiku	しんちく	新築	 new building, new construction
18047	14710	jikokuhyou	じこくひょう	時刻表	 timetable, schedule
18047	14711	jihi	じひ	慈悲	mercy, compassion, clemency, pity, charity, benevolence | Hodgson's hawk-cuckoo (Cuculus fugax), Horsfield's hawk cuckoo
18047	14712	jipeeji	じぺーじ	次ページ	
18047	14713	jiyuudo	じゆうど	自由度	 degree of freedom
18047	14714	jounai	じょうない	城内	inside of a castle | area surrounded by castle walls
18047	14715	jinseikan	じんせいかん	人生観	 view of life
18047	14716	suijou	すいじょう	水上	 aquatic, on the water, みなかみ (水上)  headwaters, source
18047	14717	sukiyaki	すきやき	すき焼き	 sukiyaki, thin slices of beef, cooked with various vegetables in a table-top cast-iron pan
18047	14718	seiiki	せいいき	聖域	sacred precincts, sanctuary, consecrated ground, holy ground | issue that is regarded as being off-limits, matter that is not up for discussion
18047	14719	seiippai	せいいっぱい	精一杯	the best one can do, one's best effort | with all one's might, to the best of one's ability
18047	14720	seijikatsudou	せいじかつどう	政治活動	 political activity
18047	14721	senshutokken	せんしゅとっけん	先取特権	 statutory lien, preferential right, prior claim
18047	14722	senpaitachi	せんぱいたち	先輩達	
18047	14723	taieki	たいえき	体液	 body fluids
18047	14724	chuugakuseiika	ちゅうがくせいいか	中学生以下	
18047	14725	chounaikai	ちょうないかい	町内会	 neighborhood association, neighbourhood association
18047	14726	toryou	とりょう	塗料	 paints, painting material
18047	14727	dousei	どうせい	同棲	 cohabitation (usu. of a romantically involved couple), living together
18047	14728	dounendai	どうねんだい	同年代	 the same generation, coeval
18047	14729	nikurui	にくるい	肉類	 (kinds of) meat
18047	14730	hanko	はんこ	判子	 seal (used in lieu of a signature), stamp, chop
18047	14731	babaa	ばばあ	婆あ	old woman | joker (card) | hag, bitch
18047	14732	fusshoku	ふっしょく	払拭	 wiping out, sweeping away, eradicating, dispelling
18047	14733	fubuki	ふぶき	吹雪	 snow storm, blizzard
18047	14734	bungakusha	ぶんがくしゃ	文学者	scholar of literature, literary person, man of letters | writer
18047	14735	bunchuu	ぶんちゅう	文中	in the sentence, in the text | Bunchū era (of the Southern Court) (1372.4.?-1375.5.27)
18047	14736	henbou	へんぼう	変貌	 transfiguration, transformation, change of appearance
18047	14737	hoshousaimu	ほしょうさいむ	保証債務	
18047	14738	bokou	ぼこう	母校	 alma mater
18047	14739	menkurau	めんくらう	面食らう	 to be confused, to be bewildered, to be taken aback
18047	14740	monomane	ものまね	物真似	 mimicry, imitation (of someone, something)
18047	14741	yadosu	やどす	宿す	to house, to contain, to harbour (a feeling), to hold (e.g. dew on leaves) | to carry (a baby), to be pregnant | to give lodging to, to accommodate, しゅくす (宿す)  to stay (at), to stop (at)
18121	14742	aikokushin	あいこくしん	愛国心	 patriotic feelings, patriotism
18121	14743	akuyou	あくよう	悪用	 abuse, misuse, perversion
18121	14744	atsukaikata	あつかいかた	扱い方	 how to manage (e.g. case), how to handle (e.g. machine), way with (e.g. children, animal)
18121	14745	atochi	あとち	跡地	 former site (of something), site (e.g. of a demolished building)
18121	14746	arawaseru	あらわせる	表わせる	
18121	14747	iseki	いせき	移籍	transfer (of one's name into another family register) | transfer (to another team, company, etc.)
18121	14748	itasa	いたさ	痛さ	
18121	14749	ippen	いっぺん	一編	 piece (e.g. poetry), poem, essay, book, story
18121	14750	iraira	いらいら	苛々	 to get irritated, to get annoyed, to be on the edge, to fret, to lose patience
18121	14751	irogami	いろがみ	色紙	 coloured paper, colored paper, しきし (色紙)  square fancy cardboard, used for autographs, poetry, etc.
18121	14752	onshitsukoukagasu	おんしつこうかがす	温室効果ガス	 greenhouse effect gas, greenhouse gas
18121	14753	kageri	かげり	陰り	 shadow or cloud (e.g. on someone's happiness), shade, gloom
18121	14754	kashitsukeru	かしつける	貸し付ける	 to lend, to loan
18121	14755	kachou	かちょう	家長	 patriarch, family head
18121	14756	kanmatsu	かんまつ	巻末	 end of a book
18121	14757	kiga	きが	飢餓	 starvation, famine, hunger
18121	14758	ku	く	来	next (year, spring, etc.), coming | since (last month, etc.), for (20 years, etc.)
18121	14759	kumitoru	くみとる	汲み取る	to draw (water), to scoop up, to dip up, to pump out | to understand (someone's feelings, etc.), to grasp, to surmise, to take into consideration
18121	14760	keizaimen	けいざいめん	経済面	financial page (of newspaper) | financial aspects, economic front
18121	14761	koudoukeikaku	こうどうけいかく	行動計画	 plan of action
18121	14762	kossetsu	こっせつ	骨折	 bone fracture
18121	14763	sakichi	さきち	佐吉	
18121	14764	sangoshou	さんごしょう	珊瑚礁	 coral reef
18121	14765	shioaji	しおあじ	塩味	 salty taste, saltiness
18121	14766	shikoushite	しこうして	而して	 and, and then, thus, and now, and finally
18121	14767	shisaku	しさく	思索	 speculation, thinking, meditation
18121	14768	shisan	しさん	試算	 trial calculation, preliminary calculation, estimation
18121	14769	shou	しょう	翔	
18121	14770	juuichinendo	じゅういちねんど	十一年度	
18121	14771	suneru	すねる	拗ねる	 to be peevish, to sulk, to pout
18121	14772	sei	せい	生	 pure, undiluted, raw, crude, なま (生) raw, uncooked, fresh | natural, as it is, unedited, unprocessed | unprotected (sex) | live (i.e. not recorded) | inexperienced, unpolished, green, crude | impudence, sauciness | unpasteurized beer, draft beer, draught beer | blank (e.g. disk), unused | just a little, somehow, vaguely, partially, somewhat, half-, semi- | insufficient, incomplete, half-baked, half-hearted, perfunctory | cash | tipsiness, うぶ (初) innocent, naive, unsophisticated, inexperienced, green, wet behind the ears | birth-, せい (生) life, living | I, me, myself | student, いく (生)  vital, virile, lively, ふ (生)  area of thick growth (of trees, grass, etc.), なまり (生り)  boiled and half-dried bonito
18121	14773	seihi	せいひ	成否	 success or failure, outcome, result
18121	14774	seimon	せいもん	正門	 main gate, main entrance
18121	14775	sousaku	そうさく	創作	creation, production, creative work (novel, film, etc.), original work, (creative) writing | fabrication, fiction, invention
18121	14776	danbooruhako	だんぼーるはこ	段ボール箱	 cardboard box, carton, corrugated box
18121	14777	chi	ち	家	house, residence, dwelling | family, household | lineage, family name, うち (家) house | one's house, one's home, one's family, one's household, け (家)  house (e.g. of Tokugawa), family, や (屋) (something) shop | somebody who sells (something) or works as (something) | somebody with a (certain) personality trait | house | roof, か (家)  -ist, -er, んち (ん家)  's house, 's home
18121	14778	tsutomesaki	つとめさき	勤め先	 place of work
18121	14779	tsunagi	つなぎ	繋ぎ	link, connection, tie, bond, contact | filler, stopgap (job, budget, etc.) | thickener (e.g. in cooking), thickening, liaison | hedging, hedge | overalls, coveralls, boiler suit | intermission (in kabuki), interval
18121	14780	tenshukaku	てんしゅかく	天守閣	 castle tower, keep, donjon
18121	14781	tenbou	てんぼう	展望	 view, outlook, prospect
18121	14782	dojouosen	どじょうおせん	土壌汚染	 soil pollution
18121	14783	naizai	ないざい	内在	 immanence, inherence, indwelling, intrinsic (cause)
18121	14784	naya	なや	納屋	 shed, barn, outhouse
18121	14785	ninmei	にんめい	任命	 appointment, nomination, ordination, commission, designation
18121	14786	hakareru	はかれる	図れる	
18121	14787	hason	はそん	破損	 damage
18121	14788	fuketsu	ふけつ	不潔	unclean, dirty, unsanitary, filthy | indecent, dirty (story, money, etc.), obscene, immoral
18121	14789	heisa	へいさ	閉鎖	 closing, closure, shutdown, lockout
18121	14790	hoshiboshi	ほしぼし	星々	 stars, the stars and planets, celestial bodies
18121	14791	mikata	みかた	味方	friend, ally, supporter | taking sides with, supporting, standing by, backing up
18121	14792	mureru	むれる	群れる	 to crowd, to flock, to swarm
18121	14793	megusuri	めぐすり	目薬	 eye drops, eyewash
18121	14794	mondaikoudou	もんだいこうどう	問題行動	
18121	14795	yuuigi	ゆういぎ	有意義	 significant, useful, meaningful, worthwhile, valuable, of interest
18121	14796	yuukan	ゆうかん	夕刊	 evening paper
18121	14797	yuuryou	ゆうりょう	優良	 superior, excellent, fine
18121	14798	yukamenseki	ゆかめんせき	床面積	 floor space
18121	14799	yushutsunyuu	ゆしゅつにゅう	輸出入	 export and import
18121	14800	rikisetsu	りきせつ	力説	 insistence, (major) emphasis, stress
