15652	12801	enchousenjou	えんちょうせんじょう	延長線上	 extension of a straight line, (conclusion) following as an extension of (an argument)
15652	12802	enban	えんばん	円盤	disk, discus, platter | flying saucer | disc media (CD, DVD, etc.)
15652	12803	oisogashii	おいそがしい	御忙しい	
15652	12804	okinodoku	おきのどく	御気の毒	
15652	12805	osae	おさえ	押さえ	weight (e.g. paperweight), pressing down | keeping control, exercising authority | having self-control, exercising self-discipline | defense, guard, deterrence
15652	12806	owarine	おわりね	終わり値	 closing price (e.g. stock exchange)
15652	12807	kaigyou	かいぎょう	開業	 opening a business, opening a practice
15652	12808	kadenseihin	かでんせいひん	家電製品	 consumer electronics, home appliances
15652	12809	kyouwakoku	きょうわこく	共和国	 republic, commonwealth
15652	12810	kirai	きらい	嫌い	disliked, hated, disagreeable | tendency, smack (of), touch (of) | distinction, discrimination, ぎらい (嫌い)  dislike, hatred, fear
15652	12811	kuchizusamu	くちずさむ	口ずさむ	 to hum (a tune), to sing to oneself, to croon
15652	12812	kuchibue	くちぶえ	口笛	 whistle (sound made with the lips)
15652	12813	kunaizaijuu	くないざいじゅう	区内在住	
15652	12814	gunpuku	ぐんぷく	軍服	 military uniform
15652	12815	kogitsukeru	こぎつける	漕ぎ着ける	to row (a boat) to (a pier, shore, etc.) | to reach (a goal after considerable effort), to arrive at, to (finally) manage to do
15652	12816	kokusaijousei	こくさいじょうせい	国際情勢	 international situation
15652	12817	shikaisha	しかいしゃ	司会者	 chairman, moderator, toastmaster, master of ceremonies, chairperson, host (of a TV show, etc.)
15652	12818	shitauke	したうけ	下請け	subcontract | subcontractor (person or company)
15652	12819	shibori	しぼり	絞り	tie-dye, tie-dyeing | aperture (e.g. camera, iris of the eye), aperture stop, stop | contraction, squeezing, choke
15652	12820	shu	しゅ	朱	 scarlet, red, あか (赤) red, crimson, scarlet | red-containing colour (e.g. brown, pink, orange) | Red (i.e. communist) | red light (traffic) | red ink (i.e. in finance or proof-reading), (in) the red | complete, total, perfect, obvious | copper | red 5-point card, しゅ (朱) cinnabar, vermillion, red, slightly-orange red | red pigment (and ink made from same) | red text (as used to correct documents)
15652	12821	shutchousuru	しゅっちょうする	出張する	
15652	12822	shutokukagaku	しゅとくかがく	取得価額	
15652	12823	shoutaijou	しょうたいじょう	招待状	 written invitation
15652	12824	shoshisaku	しょしさく	諸施策	
15652	12825	jikakushoujou	じかくしょうじょう	自覚症状	 subjective symptoms, patient's complaints
15652	12826	juuyoujikou	じゅうようじこう	重要事項	 important matter, matters of weight
15652	12827	sumidagawa	すみだがわ	隅田川	
15652	12828	seiikusuru	せいいくする	生育する	
15652	12829	seikoui	せいこうい	性行為	 sexual act, sexual intercourse
15652	12830	sendai	せんだい	先代	previous generation (e.g. one's parents), family predecessor | predecessor | previous age
15652	12831	soukousuru	そうこうする	走行する	
15652	12832	sotsugyougo	そつぎょうご	卒業後	 after graduation
15652	12833	taue	たうえ	田植え	 rice planting
15652	12834	tansaku	たんさく	探索	 search, lookup, hunt, (item of) research, exploration, investigation
15652	12835	tenokou	てのこう	手の甲	 back of the hand
15652	12836	toushishintaku	とうししんたく	投資信託	 investment trust
15652	12837	tokudan	とくだん	特段	exceptional, unusual, special | especially, exceptionally, unusually
15652	12838	doufuusuru	どうふうする	同封する	
15652	12839	naimushou	ないむしょう	内務省	 Home Ministry, Department of the Interior (US, etc.), Home Office (UK), Ministry of Home Affairs (Japan, pre-1947)
15652	12840	narikakeru	なりかける	成り掛ける	 to be on the verge, to be on the brink, to get close
15652	12841	nyuujoumuryou	にゅうじょうむりょう	入場無料	
15652	12842	haretsusuru	はれつする	破裂する	
15652	12843	furikazasu	ふりかざす	振り翳す	to raise (esp. overhead), to brandish (e.g. sword), to flourish | to wield (e.g. power, authority), to proclaim one's principles
15652	12844	houka	ほうか	放火	 arson, setting fire
15652	12845	boro	ぼろ	襤褸	rag, scrap, tattered clothes | fault (esp. in a pretense, pretence), defect | run-down, shabby, junky
15652	12846	misshitsu	みっしつ	密室	locked room | secret room
15652	12847	minyou	みんよう	民謡	 folk song, popular song
15652	12848	mushiatsui	むしあつい	蒸し暑い	 humid, sultry
15652	12849	raigetsu	らいげつ	来月	 next month
15652	12850	rakuraku	らくらく	楽々	 comfortably, easily
15717	12851	ikada	いかだ	筏	raft | forearm protector | skewered baby-eel kabayaki
15717	12852	inshouzukeru	いんしょうづける	印象付ける	 to impress (someone)
15717	12853	uragaeshi	うらがえし	裏返し	inside out, upside down | flip side, opposite, contrary, reverse
15717	12854	otoroe	おとろえ	衰え	 weakening, emaciation, decline
15717	12855	kaikomu	かいこむ	買い込む	 to buy up, to lay in a stock, to stock up, to buy a lot
15717	12856	kakarichou	かかりちょう	係長	 subsection head, assistant manager, chief clerk
15717	12857	kakushin	かくしん	革新	 reform, innovation
15717	12858	kakuseru	かくせる	隠せる	
15717	12859	katsuyori	かつより	勝頼	
15717	12860	kido	きど	木戸	wicket gate, wooden door | entrance to an entertainment venue (i.e. sumo arena, etc.)
15717	12861	kyuukan	きゅうかん	休館	 closure (of a library, museum, etc.)
15717	12862	kyuureki	きゅうれき	旧暦	 Japan's old (lunisolar) calendar
15717	12863	ken'okan	けんおかん	嫌悪感	 unpleasant feelings (e.g. hatred, disgust, revulsion, fear)
15717	12864	kouro	こうろ	航路	 (air or sea) route, course, line, run
15717	12865	kokusaikouryuu	こくさいこうりゅう	国際交流	 international exchange
15717	12866	kokuchisuru	こくちする	告知する	
15717	12867	kokumintou	こくみんとう	国民党	Constitutional Nationalist Party (1910-1922) | Guomindang (Chinese Nationalist Party), Kuomintang
15717	12868	saisokusuru	さいそくする	催促する	
15717	12869	shishi	しし	志士	imperial loyalist samurai of the Bakumatsu-era | patriots, idealists willing to sacrifice themselves for the good of the nation
15717	12870	shimei	しめい	指名	naming, nominating, designating | calling on, asking for, requesting
15717	12871	shinseijin	しんせいじん	申請人	 applicant
15717	12872	junsa	じゅんさ	巡査	 police officer, policeman, constable
15717	12873	setsuzokudekiru	せつぞくできる	接続出来る	
15717	12874	zento	ぜんと	前途	future, prospects, outlook | journey ahead, distance yet to cover
15717	12875	soumen	そうめん	素麺	 fine white noodles
15717	12876	danryokuteki	だんりょくてき	弾力的	 elastic, flexible
15717	12877	chikakusuru	ちかくする	知覚する	
15717	12878	tsugikomu	つぎこむ	注ぎ込む	 to pour into (liquids), to pump into, つぎこむ (注ぎ込む)  to invest in, to sink money into, to put into, to lay out (funds), to inject, to impregnate, to infuse, to instill, to implant, to imbue, to focus (attention, efforts)
15717	12879	toyamaken	とやまけん	富山県	 Toyama prefecture (Hokuriku area)
15717	12880	nikkeijin	にっけいじん	日系人	 non-Japanese of Japanese descent, nikkeijin
15717	12881	haikei	はいけい	拝啓	 Dear (so and so), Dear Sir, Dear Madam, To Whom It May Concern
15717	12882	hashirinukeru	はしりぬける	走り抜ける	 to run through, to run past
15717	12883	habataku	はばたく	羽ばたく	to flap (wings) | to spread one's wings, to go out into the world
15717	12884	hitsujuhin	ひつじゅひん	必需品	 necessities, necessary article, requisite, essentials
15717	12885	fuu	ふう	封	 seal
15717	12886	houki	ほうき	放棄	 abandonment, renunciation, resignation, abdication (responsibility, right)
15717	12887	hojuusuru	ほじゅうする	補充する	
15717	12888	hodohodo	ほどほど	程々	 moderate
15717	12889	mabayui	まばゆい	眩い	 cute, pretty, まばゆい (眩い)  dazzling, glaring, dazzlingly beautiful
15717	12890	mino	みの	美濃	 Mino (former province located in the south of present-day Gifu Prefecture)
15717	12891	mujin	むじん	無人	unmanned, uninhabited, unattended, deserted | shorthandedness, lack of help
15717	12892	motehayasu	もてはやす	持て囃す	 to praise extravagantly, to lionize, to lionise, to make much of
15717	12893	yosan'iinkai	よさんいいんかい	予算委員会	Budget Committee (of the Upper and Lower Houses of the Diet) | budget committee
15717	12894	yobimodosu	よびもどす	呼び戻す	to call (someone) back, to recall, to call home | to bring back (memories, etc.), to recall, to revive
15717	12895	yomiyasui	よみやすい	読み易い	 easy to read, legible, clear
15717	12896	ransou	らんそう	卵巣	 ovary
15717	12897	ryoukan	りょうかん	良寛	
15717	12898	rekishika	れきしか	歴史家	 historian
15717	12899	wakatsu	わかつ	分かつ	to divide, to separate | to share, to distribute | to distinguish
15772	12900	ikisugiru	いきすぎる	行き過ぎる	to go too far, to go past | to go to extremes, to overdo it
