10189	8401	chichi	ちち	乳	milk | breast | loop | decorative bump (on a hanging bell)
10189	8402	chuunyuu	ちゅうにゅう	注入	 pouring, injection
10189	8403	nakigoe	なきごえ	泣き声	 cry, crying voice
10189	8404	nanjuunen	なんじゅうねん	何十年	
10189	8405	nemuke	ねむけ	眠気	 sleepiness, drowsiness
10189	8406	hai	はい	配	
10189	8407	fukakachi	ふかかち	付加価値	 added value, value added
10189	8408	houkatsuteki	ほうかつてき	包括的	 comprehensive, inclusive, encompassing
10189	8409	boke	ぼけ	惚け	fool, idiot | dotage, senility, dementia | touched in the head (from), out of it (from), feeling sluggish (from), not yet up to par (after) | funny man (of a comedy duo), とぼけ (恍け)  assumed innocence, feigned ignorance
10209	8410	kaiji	かいじ	開示	 release (e.g. information), disclosure (legal), show, indication, display
10209	8411	kainyuu	かいにゅう	介入	 intervention
10209	8412	kasumu	かすむ	霞む	to become misty, to become hazy | to get blurry, to grow dim | to be overshadowed, to be upstaged, to be outshone
10209	8413	kangofusan	かんごふさん	看護婦さん	
10209	8414	kojiki	こじき	古事記	 Kojiki, Records of Ancient Matters, Japan's oldest historical record
10209	8415	kokki	こっき	国旗	 national flag
10209	8416	sazo	さぞ	嘸	 surely, certainly, no doubt, indeed
10209	8417	sachiko	さちこ	幸子	
10209	8418	sousai	そうさい	総裁	 president (of an organization), director general, governor (of a central bank), party leader (esp. LDP)
10209	8419	doukan	どうかん	同感	 same feeling, same sentiment, same opinion, sympathy, agreement, concurrence
10209	8420	hanataba	はなたば	花束	 bunch of flowers, bouquet
10209	8421	hitokumi	ひとくみ	一組	 one class, one set, a pair, a suite, a series
10209	8422	bunri	ぶんり	分離	 separation, partition, detachment, segregation, isolation
10209	8423	honoka	ほのか	仄か	faint, indistinct, dim | few, a little
10209	8424	matsumoto	まつもと	松本	
10209	8425	moushikomisho	もうしこみしょ	申し込み書	 (written) application, application form
10209	8426	youshi	ようし	容姿	 (physical) appearance (of a person), one's face and figure
10231	8427	ikujikyuugyou	いくじきゅうぎょう	育児休業	 childcare leave, leave taken after the compulsory maternity leave
10231	8428	uruoi	うるおい	潤い	moisture, damp, wetness | richness, warmth, interest, taste, charm | financial leeway, gains, profit | blessing, grace, favour, favor
10231	8429	eigyouman	えいぎょうまん	営業マン	 salesman, businessman
10231	8430	gakuzen	がくぜん	愕然	 astonished, shocked, amazed, astounded, aghast
10231	8431	gyouseikaikaku	ぎょうせいかいかく	行政改革	 administrative reform
10231	8432	gendaijin	げんだいじん	現代人	 modern person, people of today
10231	8433	jitsumu	じつむ	実務	 practical business, practical work experience, practicum, practice
10231	8434	hamono	はもの	刃物	 edged tool, cutlery
10231	8435	hikitomeru	ひきとめる	引き止める	 to detain, to check, to restrain
10231	8436	funin	ふにん	赴任	 moving to a different location to start a new job, (proceeding to) new appointment
10231	8437	buji	ぶじ	無事	safety, security, peace, quiet | safely, without incident, successfully | good health | inaction, ennui
10231	8438	muzan	むざん	無残	cruel, merciless, atrocious, ruthless, cold-blooded | pitiful, tragic, horrible, miserable | breaking a religious precept without shame
10231	8439	reitou	れいとう	冷凍	 freezing, cold storage, refrigeration
10249	8440	iku	いく	生く	to live, to exist | to bring to life
10249	8441	ippanjin	いっぱんじん	一般人	 ordinary person, member of the general public, non-celebrity
10249	8442	omoiegaku	おもいえがく	思い描く	 to imagine, to picture, to figure, to see
10249	8443	kandakai	かんだかい	甲高い	 high-pitched, shrill
10249	8444	kanpai	かんぱい	乾杯	cheers, bottoms-up, prosit | toast, drink (in celebration or in honor of something) | drinking one's glass dry
10249	8445	kyokudo	きょくど	極度	 maximum, extreme, utmost
10249	8446	kurokami	くろかみ	黒髪	 black hair
10249	8447	keizairyoku	けいざいりょく	経済力	 economic strength
10249	8448	keichou	けいちょう	慶長	 Keichō era (1596.10.27-1615.7.13)
10249	8449	gentei	げんてい	限定	 limit, restriction
10249	8450	same	さめ	鮫	 shark
10249	8451	shinsei	しんせい	神聖	 holiness, sacredness, sanctity, dignity
10249	8452	suihei	すいへい	水平	 horizontal, level, even
10249	8453	tachitsukusu	たちつくす	立ち尽くす	 to stand stock still
10249	8454	tatoe	たとえ	例え	example | simile, metaphor, allegory, fable, parable
10249	8455	dakyou	だきょう	妥協	 compromise, giving in
10249	8456	tori	とり	取り	taking, taker, collecting, collector, remover, removal | last performer of the day (usu. the star performer), last performance of the day | active partner (e.g. in judo demonstration) | emphatic or formal prefix, どり (取り) samurai receiving this much rice as a fee | offering of rice cake containing this much rice | person receiving this amount of money as a salary
10249	8457	michinori	みちのり	道程	distance, journey, itinerary | path (e.g. to one's goal), way, process, route, road
10249	8458	warikiru	わりきる	割り切る	to find a clear solution, to come to a clean decision, to give a clear explanation | to divide exactly (without remainder), to divide evenly
10272	8459	omoitatsu	おもいたつ	思い立つ	 to set one's mind on doing, to get the idea of doing, to make up one's mind
10272	8460	omote	おもて	表	surface | face (i.e. the visible side of an object) | front (of a building, etc.), obverse side (i.e. "head") of a coin | outside, exterior | appearance | public | first half (of an inning), top (of an inning) | cover (for tatami mats, etc.) | foreground, ひょう (表) table, chart, list | memorial to an emperor
10272	8461	kai	かい	回	counter for occurrences | a time, an instance | inning (baseball), round, game | episode, chapter, instalment | Hui (people) | Islam
10272	8462	kakegoe	かけごえ	掛け声	 shout (of encouragement, etc.), yell (used to time or encourage activity, e.g. "Heave ho!")
10272	8463	kokkei	こっけい	滑稽	funny, comical, humorous, laughable | ridiculous, silly, absurd
10272	8464	zenshutsu	ぜんしゅつ	前出	 aforementioned, above-mentioned, given above, previous
10272	8465	chokusetsukaijou	ちょくせつかいじょう	直接会場	
10272	8466	dousentaa	どうせんたー	同センター	
10272	8467	hatarakikake	はたらきかけ	働き掛け	 pressure, encouragement, urging, promoting
10272	8468	fuka	ふか	不可	wrong, bad, improper, unjustifiable, inadvisable | not allowed, not possible | failing grade
10272	8469	henkei	へんけい	変形	 transformation, variation, metamorphosis, modification, deformation, variety, deformity, monster
10272	8470	mangaichi	まんがいち	万が一	(if) by some chance, by some possibility, in the unlikely event that, 10000 to 1 | (unlikely event of) emergency, the worst(-case scenario)
10272	8471	meidai	めいだい	命題	proposition, thesis, notion, theory | problem, issue, challenge
10272	8472	yoru	よる	選る	 to choose, to select
10292	8473	ukiagaru	うきあがる	浮き上がる	to float, to rise to the surface | to stand out, to be visible | to be alienated
10292	8474	oufuku	おうふく	往復	making a round trip, going and returning, coming and going | round-trip ticket, return ticket | correspondence, exchanging (letters) | socializing, visiting one another
10292	8475	kakikaeru	かきかえる	書き替える	 to rewrite, to overwrite, to renew, to transfer
10292	8476	keitou	けいとう	系統	system | lineage, ancestry, family line | group (e.g. of colors) (colours), family (e.g. of languages), party, school (of thought) | close (evolutionary) relationship | a population sharing a common ancestor (in genetics), strain (e.g. bacterial)
10292	8477	kofun	こふん	古墳	 ancient burial mound, barrow, tumulus
10292	8478	shuukyouteki	しゅうきょうてき	宗教的	 religious, spiritual
10292	8479	joushikiteki	じょうしきてき	常識的	 ordinary, sensible, commonplace
10292	8480	torishimaru	とりしまる	取り締まる	to manage, to control, to supervise, to oversee, to command | to crack down on, to keep under strict control, to enforce, to regulate
10292	8481	fushinkan	ふしんかん	不信感	 distrust, suspicion
10292	8482	fusegeru	ふせげる	防げる	
10292	8483	henkan	へんかん	返還	 return, restoration
10292	8484	honshi	ほんし	本市	
10292	8485	mamoreru	まもれる	守れる	
10309	8486	aiken	あいけん	愛犬	pet dog, beloved dog | love of dogs, fondness for dogs
10309	8487	itoguchi	いとぐち	糸口	beginning, start, first step | clue, lead, hint | thread end
10309	8488	ooya	おおや	大家	 landlord, landlady, たいか (大家) master, expert, authority, leading figure | mansion, large house | rich family, distinguished family, たいけ (大家)  rich family, distinguished family
10309	8489	okotowari	おことわり	御断り	
10309	8490	kake	かけ	賭け	 bet, wager, stake, gamble
10309	8491	ganzen	がんぜん	眼前	 before one's eyes
10309	8492	gokigen	ごきげん	御機嫌	humour, humor, temper, mood, spirits | safety, health, well-being, one's situation | in a good mood, in high spirits, happy, cheery, merry, chipper
10309	8493	saidan	さいだん	祭壇	 altar
10309	8494	shakaihoken	しゃかいほけん	社会保険	 social insurance
10309	8495	shochou	しょちょう	所長	 chief, head (of an office, of a laboratory)
10309	8496	shinseihin	しんせいひん	新製品	 new product, new line (of products)
10309	8497	shinchiku	しんちく	新築	 new building, new construction
10309	8498	sumi	すみ	炭	charcoal | charred remains
10309	8499	soushou	そうしょう	総称	 general term, generic name
10309	8500	somatsu	そまつ	粗末	 crude, rough, plain, humble, shabby
