9561	7901	seiteki	せいてき	性的	(relating to) gender | sex, sexual
9561	7902	soujite	そうじて	総じて	in general, generally | as a whole, all in all, altogether, summing it up
9561	7903	dassuru	だっする	脱する	 to escape from, to get out
9561	7904	tetsugakusha	てつがくしゃ	哲学者	 philosopher
9561	7905	mayonaka	まよなか	真夜中	 dead of night, midnight
9561	7906	munamoto	むなもと	胸元	breast, chest | pit of the stomach, solar plexus, epigastrium
9561	7907	yokusou	よくそう	浴槽	 bathtub
9570	7908	anesan	あねさん	姉さん	older sister, elder sister | young lady | miss | ma'am
9570	7909	iradachi	いらだち	苛立ち	 irritation, annoyance, frustration
9570	7910	kenkouzukuri	けんこうづくり	健康作り	
9570	7911	konbu	こんぶ	昆布	 kombu (usu. Saccharina japonica), konbu, kelp, any edible species from the family Laminariaceae
9570	7912	saishuukai	さいしゅうかい	最終回	 last time, last inning, last part, final episode (of a television program)
9570	7913	shutsuensha	しゅつえんしゃ	出演者	 performer, entertainer, actor
9570	7914	shirei	しれい	指令	 orders, instructions, directive, command
9570	7915	jiki	じき	直	straight | ordinary, common | doing nothing, ひた (直)  earnestly, immediately, exactly, じき (直) soon, in a moment, before long, shortly | nearby, close | direct | spot transaction, cash transaction, ちょく (直) direct, in person, frankness, honesty, simplicity, cheerfulness, correctness, being straight | night duty, shift (e.g. in a factory), あたい (直)  Atai (post-Taika hereditary title often given to regional administrators), じか (直)  direct, ただ (直)  straight, direct, ね (値) price, cost | value, worth, merit
9570	7916	tokaku	とかく	兎角	(doing) various things, (doing) this and that | being apt to, being prone to, tending to | at any rate, anyhow, anyway | all sorts of (negative things), various | things that do not exist, rabbit horns
9570	7917	nakayoshi	なかよし	仲良し	 intimate friend, close friend, bosom buddy, chum
9570	7918	hen	へん	変	strange, odd, peculiar, weird, curious, queer, eccentric, funny, suspicious, fishy | unexpected | change | incident, disturbance, disaster, accident | flat
9570	7919	mouke	もうけ	儲け	 profit, earnings
9570	7920	yakiniku	やきにく	焼き肉	yakiniku, Japanese dish of grilled meat similar to Korean barbecue | roasted meat, grill
9587	7921	arawasu	あらわす	著わす	 to write, to publish
9587	7922	onegaimoushiageru	おねがいもうしあげる	御願い申し上げる	
9587	7923	gendouryoku	げんどうりょく	原動力	 motive power, driving force
9587	7924	shouchouteki	しょうちょうてき	象徴的	 symbolic
9587	7925	shinrigaku	しんりがく	心理学	 psychology
9587	7926	jochuu	じょちゅう	女中	maid, female servant | hostess (in a ryokan), waitress (in a traditional restaurant) | court lady
9587	7927	zehi	ぜひ	是非	certainly, without fail | right and wrong, pros and cons
9587	7928	namanamashii	なまなましい	生々しい	vivid (memory, description, etc.), fresh, graphic, raw, true-to-life, first-hand (experience) | fresh (blood, scar, etc.), still new, recent, just occurred
9587	7929	hae	はえ	蠅	fly (any insect of infraorder Muscomorpha) | person of no worth, pisher, scrub
9587	7930	hakuhatsu	はくはつ	白髪	 white hair, grey hair, gray hair
9587	7931	honshi	ほんし	本紙	 this newspaper
9601	7932	osoruosoru	おそるおそる	恐る恐る	 fearfully, timidly, nervously, cautiously, gingerly
9601	7933	kutsugaesu	くつがえす	覆す	to overturn, to capsize, to upset | to overthrow (government etc.) | to reverse (decision etc.), to disprove (an established theory etc.), to overrule
9601	7934	kokan	こかん	股間	 nether region, between the legs, groin, crotch
9601	7935	koyousuru	こようする	雇用する	
9601	7936	sabi	さび	錆	 rust
9601	7937	sunpou	すんぽう	寸法	measurement, size, extent, dimension | plan, intention, arrangement, schedule
9601	7938	sounyuu	そうにゅう	挿入	 insertion, incorporation, infixing
9601	7939	danzen	だんぜん	断然	firmly, absolutely, flatly, resolutely, decisively, definitely | by far, far and away, by a long shot, hands down
9601	7940	tekiou	てきおう	適応	 adaptation, accommodation, conformity
9601	7941	tenshoku	てんしょく	転職	 change of occupation, career change
9601	7942	hitosorezore	ひとそれぞれ	人其々	 to each his own, people differ, different people (have different likes)
9601	7943	bukuro	ぶくろ	袋	bag, sack, pouch | skin of an orange (and other like fruits) | dead end | plot of land surrounded by water, たい (袋)  counter for things inside a bag
9601	7944	hossuru	ほっする	欲する	 to want, to desire
9601	7945	hori	ほり	堀	moat, fosse | canal, ditch
9601	7946	ryoutan	りょうたん	両端	both ends, either end, both edges | double-mindedness, sitting on the fence
9620	7947	anatajishin	あなたじしん	貴方自身	
9620	7948	ieie	いえいえ	家々	 each house, every house, many houses
9620	7949	genyu	げんゆ	原油	 crude oil
9620	7950	koneko	こねこ	子猫	kitten | small cat
9620	7951	shokuryouhin	しょくりょうひん	食料品	 foodstuff, groceries
9620	7952	jiban	じばん	地盤	ground, crust (earth), bed (gravel, river, etc.) | foundation (building, etc.), base | constituency, power base, support (electoral), footing, foothold
9620	7953	nankagetsu	なんかげつ	何箇月	 how many months?, how long?
9620	7954	nokeru	のける	退ける	 to repel, to drive away, to repulse, to reject, のける (退ける) to put something out of the way, to move (something, someone) aside | to remove, to exclude, to take away | to set aside, to keep apart | to remove (someone) from the group, to shun | to do well despite difficulties, to accomplish despite adversity | to do resolutely, to do boldly
9620	7955	hotori	ほとり	辺	area, vicinity, region | side, edge | circumstances, へ (辺) surrounding area | shore (of the sea) | suffix used as a rough indicator of location, direction, time, etc., ほとり (辺)  side (esp. of a waterbody), edge, bank, shore, わたり (辺り)  neighbourhood, vicinity, nearby
9620	7956	migiue	みぎうえ	右上	 upper right
9620	7957	mitsu	みつ	蜜	nectar | honey | honeydew | treacle, molasses | sorbitol (when visible as dark patches inside an apple)
9620	7958	mujaki	むじゃき	無邪気	 innocent, simple-minded
9637	7959	aichaku	あいちゃく	愛着	 attachment (esp. to things), love, affection
9637	7960	isshitsu	いっしつ	一室	 one room
9637	7961	iyagarase	いやがらせ	嫌がらせ	 harassment, pestering
9637	7962	okigaru	おきがる	御気軽	
9637	7963	kaimu	かいむ	皆無	 nonexistent, nil, none, nothing (at all), bugger-all
9637	7964	karamiau	からみあう	絡み合う	 to be(come) intertwined, to be entangled
9637	7965	kariire	かりいれ	借り入れ	 debt
9637	7966	kankyoukijun	かんきょうきじゅん	環境基準	 environmental standard
9637	7967	keikai	けいかい	警戒	 vigilance, caution, alertness, precaution, being on guard
9637	7968	genso	げんそ	元素	element, chemical element | (classical) element (e.g. earth, water, air, fire) | origin, source
9637	7969	gouseisuru	ごうせいする	合成する	
9637	7970	sarau	さらう	攫う	to carry off, to run away with, to sweep away, to snatch, to kidnap, to abduct | to take entirely for oneself, to monopolize
9637	7971	shinnen	しんねん	新年	 New Year
9637	7972	suiso	すいそ	水素	 hydrogen (H)
9637	7973	seifusankoujin	せいふさんこうじん	政府参考人	
9637	7974	hanashikata	はなしかた	話し方	 way of talking, speaking style
9637	7975	bokujou	ぼくじょう	牧場	farm (livestock), stock farm, ranch, station | pasture, meadow, grazing land
9637	7976	midokoro	みどころ	見所	point worthy of note, highlight, high point, main attraction, thing to note | good prospects for the future, promise, けんじょ (見所) audience seating (noh theater) | audience (esp. in noh)
9637	7977	moushikomijun	もうしこみじゅん	申し込み順	 order of applications, in order of application
9637	7978	mochitsuzukeru	もちつづける	持ち続ける	 to continue to hold, to hold on to (for a long period), to maintain, to keep
9637	7979	monotariru	ものたりる	物足りる	
9637	7980	mondaikaiketsu	もんだいかいけつ	問題解決	 problem-solving
9637	7981	raigetsu	らいげつ	来月	 next month
9665	7982	anzuru	あんずる	案ずる	to be anxious or concerned about, to ponder (anxiously), to fear | to investigate, to consider, to plan | to pat, to rub, to take a sword in one's hand
9665	7983	ittsuu	いっつう	一通	one copy (of a document), one letter | one-way traffic | pure straight, winning hand containing nine consecutive tiles of the same suit (i.e. 1-9)
9665	7984	itonami	いとなみ	営み	activity, action, performance, execution | occupation, business, work | sexual intercourse, sex | preparations
9665	7985	kyousouryoku	きょうそうりょく	競争力	 competitiveness, competitive edge, competitive power
9665	7986	kouhou	こうほう	広報	public relations, PR, publicity, public information | publicizing
9665	7987	shousha	しょうしゃ	商社	 trading company
9665	7988	setten	せってん	接点	tangent point, point of contact | contact (electrical, etc.) | point of agreement, common ground, interaction
9665	7989	sonzoku	そんぞく	存続	 duration, continuance, survival, persistence, retention
9665	7990	tazusaeru	たずさえる	携える	to carry in one's hand, to carry with one, to have on one's person, to bear | to take along (someone), to take (someone) with one, to be accompanied by
9665	7991	neji	ねじ	螺子	screw | key (of a clock, watch, etc.), spring (of a clock, watch, etc.)
9665	7992	hatan	はたん	破綻	 failure, collapse, breakdown, break-up, bankruptcy
9665	7993	hyouteki	ひょうてき	標的	 target
9665	7994	hokubu	ほくぶ	北部	 northern part, the north (of a region)
9680	7995	assen	あっせん	斡旋	kind offices, services, through the good offices of, influence | intercession, mediation
9680	7996	inbou	いんぼう	陰謀	plot, intrigue, scheme | conspiracy, agreement between two or more people to commit an unlawful act
9680	7997	kokusaikyouryoku	こくさいきょうりょく	国際協力	 international cooperation
9680	7998	koten	こてん	古典	 classic (work, esp. book), the classics
9680	7999	jisoku	じそく	時速	 speed (per hour)
9680	8000	jinzou	じんぞう	腎臓	 kidney
