21271	17301	inoki	いのき	猪木	
21271	17302	umetate	うめたて	埋め立て	 land reclamation
21271	17303	unsei	うんせい	運勢	 fortune, luck
21271	17304	enoki	えのき	榎	Japanese hackberry (Celtis sinensis var. japonica), Chinese nettle tree | enoki mushroom (Flammulina velutipes), winter mushroom, velvet shank, enokitake, enokidake
21271	17305	erimoto	えりもと	襟元	(around the) neck, nape | collar (at the front)
21271	17306	oushitsu	おうしつ	王室	 royal family
21271	17307	oomoto	おおもと	大本	 foundation, basic principles, おおもと (大本) root, origin, source, cause, basis, foundation | Ōmoto (religion)
21271	17308	okina	おきな	翁	old man, venerable gentleman | venerable, old, father
21271	17309	okoridasu	おこりだす	怒り出す	 to fly into a rage, to lose one's temper, to flare up, to break out
21271	17310	oshou	おしょう	和尚	preceptor or high priest (esp. in Zen or Pure Land Buddhism) | preceptor or high priest (in Tendai or Kegon Buddhism) | preceptor or high priest (in Shingon, Hosso, Ritsu or Shin Buddhism) | second highest priestly rank in Buddhism | monk (esp. the head monk of a temple) | master (of one's art, trade, etc.)
21271	17311	oda	おだ	小田	 rice field (usu. small)
21271	17312	onakunarininaru	おなくなりになる	御亡くなりに成る	
21271	17313	kaibatsu	かいばつ	海抜	 height above sea level
21271	17314	kakugiketteisuru	かくぎけっていする	閣議決定する	
21271	17315	kakezan	かけざん	掛け算	 multiplication
21271	17316	kazokukankei	かぞくかんけい	家族関係	
21271	17317	kamei	かめい	加盟	 joining (an association, agreement, etc.), participation, affiliation, accession
21271	17318	kansaiinkai	かんさいいんかい	監査委員会	
21271	17319	kigane	きがね	気兼ね	 constraint, reserve, feeling hesitant, being afraid of troubling someone
21271	17320	kishi	きし	岸	 bank, coast, shore
21271	17321	kinako	きなこ	黄な粉	 roasted soybean flour, roasted soy flour
21271	17322	kousakuin	こうさくいん	工作員	spy, agent provocateur, covert operative | maker, builder, constructor
21271	17323	kouseinou	こうせいのう	高性能	 high efficiency, high performance
21271	17324	kosshi	こっし	骨子	 main point, gist, essentials, bones (e.g. of an idea), pith, さいころ (骰子)  dice, die
21271	17325	saitaku	さいたく	採択	 adoption, selection, choice
21271	17326	sairiyousuru	さいりようする	再利用する	
21271	17327	sakuseisuru	さくせいする	作製する	
21271	17328	shian	しあん	思案	 careful thought, consideration, deliberation, reflection, rumination, pondering
21271	17329	shinobaseru	しのばせる	忍ばせる	 to conceal, to hide
21271	17330	shibu	しぶ	支部	 branch, subdivision
21271	17331	shiminken	しみんけん	市民権	citizenship, civic rights, civil rights | widespread acceptance, social recognition, common use
21271	17332	shakaifukushihoujin	しゃかいふくしほうじん	社会福祉法人	 social welfare service corporation
21271	17333	shuppinshasama	しゅっぴんしゃさま	出品者様	
21271	17334	shoudan	しょうだん	商談	 business discussion, negotiation
21271	17335	shouhinkasuru	しょうひんかする	商品化する	
21271	17336	shozousuru	しょぞうする	所蔵する	
21271	17337	shirai	しらい	白井	
21271	17338	shiwasu	しわす	師走	 twelfth month (esp. of the lunar calendar), December
21271	17339	juuji	じゅうじ	十字	 cross, crossed, cruciform
21271	17340	jubaku	じゅばく	呪縛	 spell (that restricts one's movements), binding spell
21271	17341	junko	じゅんこ	純子	
21271	17342	junshu	じゅんしゅ	順守	 observance (of laws, rules, etc.), adherence, obeying, following, abiding by, compliance
21271	17343	jouon	じょうおん	常温	normal temperature, room temperature | constant temperature, fixed temperature
21271	17344	suisei	すいせい	彗星	 comet
21271	17345	suppadaka	すっぱだか	素っ裸	nudity | stark naked, in one's bare skin | penniless
21271	17346	seikyuu	せいきゅう	性急	 hasty, rash, rushed, hurried, impatient, impetuous, quick-tempered
21271	17347	setsumeibun	せつめいぶん	説明文	 explanatory note
21271	17348	senmenki	せんめんき	洗面器	 wash basin, wash bowl (incl. portable bowl in a public bath)
21271	17349	soburi	そぶり	素振り	 behavior, behaviour, manner, attitude, bearing, すぶり (素振り)  practice-swinging (sword, bat, tennis racket, etc.)
21271	17350	tatekaeru	たてかえる	建て替える	 to rebuild, to reconstruct
21271	17351	tabehoudai	たべほうだい	食べ放題	 all-you-can-eat, eating as much as one likes
21271	17352	tanshou	たんしょう	単勝	 winning at the races
21271	17353	chaba	ちゃば	茶葉	 tea leaf, tea leaves
21271	17354	tekkin	てっきん	鉄筋	rebar, (iron) reinforcing bar, reinforcing steel | reinforced concrete
21271	17355	tenpu	てんぷ	添付	 attaching (documents, etc.), appending, affixing
21271	17356	denikui	でにくい	出難い	 can't occur easily, difficult to happen
21271	17357	denkaseihin	でんかせいひん	電化製品	 electrical appliances, electric appliances
21271	17358	tokusanhin	とくさんひん	特産品	 local specialty, special product (of a region)
21271	17359	torie	とりえ	取り柄	 worth, merit, value, good point, redeeming feature, saving grace
21271	17360	nasake	なさけ	情け	pity, sympathy, compassion, mercy | affection, love
21271	17361	nantaru	なんたる	何たる	what (e.g. "what rudeness") | what (something) is like
21271	17362	nanba	なんば	難波	 Naniwa (former name for Osaka region)
21271	17363	nichibeikankei	にちべいかんけい	日米関係	 relationship between Japan and the United States, Japanese-American relations
21271	17364	nyuukai	にゅうかい	入会	 admission, joining, enrollment, enrolment, いりあい (入会)  common (e.g. fishery or hunting ground), commonage
21271	17365	nyuukoku	にゅうこく	入国	 entry into a country
21271	17366	ninsou	にんそう	人相	looks, countenance, facial features | physiognomy
21271	17367	hakurikiko	はくりきこ	薄力粉	 cake flour, pastry flour
21271	17368	hasshasuru	はっしゃする	発車する	
21271	17369	hikiau	ひきあう	引き合う	to pay, to be profitable | to pull against each other
21271	17370	hishimeku	ひしめく	犇めく	 to clamour, to crowd, to jostle
21271	17371	hikken	ひっけん	必見	 must-see, not to be missed, a must
21271	17372	hihyouji	ひひょうじ	非表示	hidden, non-display | to hide (window, etc.)
21271	17373	hiretsu	ひれつ	卑劣	 mean, contemptible, despicable, dirty, foul, cowardly, base
21271	17374	bikou	びこう	尾行	 shadow, tail, following
21271	17375	fugou	ふごう	符号	sign, mark, symbol, code | sign (e.g. positive, negative)
21271	17376	fumikiri	ふみきり	踏切	railway crossing, railroad crossing, train crossing, level crossing | starting line, scratch | determination | stepping over the edge of the ring
21271	17377	heigen	へいげん	平原	 plain, moor, prairie
21271	17378	bekkyo	べっきょ	別居	 separation, living apart
21271	17379	honobono	ほのぼの	仄々	dimly, faintly, with a faint light | warmly, friendly, in a heartwarming manner
21271	17380	maichiefukuro	まいちえふくろ	マイ知恵袋	
21271	17381	mishuugakuji	みしゅうがくじ	未就学児	 pre-school child, pre-schooler
21271	17382	mitsunori	みつのり	満典	
21271	17383	yuubokumin	ゆうぼくみん	遊牧民	 nomad
21271	17384	yuuyu	ゆうゆ	悠由	
21271	17385	yuruginai	ゆるぎない	揺るぎない	 solid, firm, steady, unshakeable, unwavering
21271	17386	ranpitsuranbun	らんぴつらんぶん	乱筆乱文	 (my) poor writing, scribbling, hasty writing
21271	17387	rinshou	りんしょう	臨床	 clinical (e.g. pathology, physiology)
21271	17388	watari	わたり	渡り	crossing, passage, transit | importing, import | wandering, wanderer | migration | contact, relations, negotiations | connection (in the game of go) | glide
21375	17389	asobikata	あそびかた	遊び方	
21375	17390	ahen	あへん	阿片	 opium
21375	17391	amaneku	あまねく	遍く	 widely, extensively, far and wide, everywhere, all around, generally, universally
21375	17392	amerikashakai	あめりかしゃかい	アメリカ社会	
21375	17393	iingoshiteki	いいんごしてき	委員御指摘	
21375	17394	ireru	いれる	居れる	
21375	17395	urauchisuru	うらうちする	裏打ちする	
21375	17396	eibin	えいびん	鋭敏	 sharp, keen, acute
21375	17397	ooyorokobisuru	おおよろこびする	大喜びする	
21375	17398	kaiketsuhou	かいけつほう	解決法	 solution, way out
21375	17399	kaigoyobou	かいごよぼう	介護予防	 preventive care, esp. for senior citizens
21375	17400	kazuya	かずや	和也	
