5506	4601	kuguru	くぐる	潜る	to go under, to pass under, to go through, to pass through | to dive (into or under the water) | to evade, to get around, to slip past | to survive, to surmount, もぐる (潜る) to dive (into or under water) | to get under, to get into, to get in, to creep into, to crawl under, to bury oneself, to burrow into, to dig oneself into, to snuggle under | to hide oneself (esp. from the government), to conceal oneself, to go underground
5506	4602	juunan	じゅうなん	柔軟	 flexible, lithe, soft, pliable
5506	4603	taizai	たいざい	滞在	 stay, sojourn
5506	4604	nin'i	にんい	任意	optional, voluntary, arbitrary, random, discretionary, facultative, spontaneous, any | arbitrary
5506	4605	hiji	ひじ	肘	 elbow
5512	4606	ojiisan	おじいさん	御爺さん	grandfather | male senior-citizen
5512	4607	gouka	ごうか	豪華	 extravagant, lavish, opulent, luxurious, magnificent, splendid, fancy, gorgeous
5512	4608	saisei	さいせい	再生	resuscitation, regeneration, restoration to life | reformation, rehabilitation | playback, regeneration (sound, etc.), view (of a video clip) | reclamation, recovery | rebirth, reincarnation
5512	4609	shizenkankyou	しぜんかんきょう	自然環境	 natural (physical) environment
5512	4610	shuutome	しゅうとめ	姑	 mother-in-law
5512	4611	shinka	しんか	進化	 evolution, progress
5512	4612	jikaku	じかく	自覚	 self-consciousness, self-awareness
5512	4613	yakkai	やっかい	厄介	trouble, burden, nuisance, bother, worry | care, dependence, support, kindness, obligation, staying (with a person)
5523	4614	kyoumifukai	きょうみふかい	興味深い	 very interesting, of great interest
5523	4615	gichou	ぎちょう	議長	 chair, chairman, chairperson, speaker (of an assembly), president (of a council, senate, etc.)
5523	4616	sakugen	さくげん	削減	 cut, reduction, curtailment
5523	4617	naosara	なおさら	尚更	still more, even more, all the more | still less, even less
5523	4618	nariyasui	なりやすい	成り易い	
5523	4619	nipponkeizai	にっぽんけいざい	日本経済	 Japanese economy
5523	4620	nyuugaku	にゅうがく	入学	 entry to school or university, matriculation, enrolment (in university, etc.) (enrollment)
5523	4621	hagemu	はげむ	励む	 to strive, to endeavour, to endeavor, to make an effort, to be zealous
5523	4622	hikikaesu	ひきかえす	引き返す	 to turn back, to go back, to come back, to return, to retrace one's steps
5523	4623	meiyo	めいよ	名誉	 honor, honour, credit, prestige
5534	4624	kansuu	かんすう	関数	function | function (programming)
5534	4625	gyouretsu	ぎょうれつ	行列	line, queue, procession, parade | matrix
5534	4626	sankadekiru	さんかできる	参加出来る	
5534	4627	jogen	じょげん	助言	 advice, counsel, suggestion, tip, hint
5534	4628	naganen	ながねん	長年	 long time, many years
5534	4629	nagusameru	なぐさめる	慰める	 to comfort, to console, to amuse
5534	4630	nenmatsu	ねんまつ	年末	 end-of-year
5534	4631	houkai	ほうかい	崩壊	collapse, crumbling, breaking down, caving in | (radioactive) decay, disintegration
5545	4632	oshirase	おしらせ	御知らせ	 notice, notification
5545	4633	kanau	かなう	敵う	to come true (of a wish, prayer, etc.), to be realized, to be fulfilled | to suit (e.g. a purpose), to meet (wishes, ideals, etc.), to conform to (standards, rules, etc.), to be consistent with | to match (implies competition), to rival, to bear (e.g. the heat)
5545	4634	kanzou	かんぞう	肝臓	 liver
5545	4635	shimi	しみ	染み	stain, spot, smudge, blot, smear, blotch | spot (on one's skin, e.g. chloasma, liver spot), blemish, discoloration, freckle
5545	4636	soukyuu	そうきゅう	早急	 immediate, prompt, quick, rapid, urgent, pressing
5545	4637	doku	どく	毒	poison, toxicant | harm, evil influence | ill will, spite, malice | abusive language
5552	4638	zaseki	ざせき	座席	 seat
5552	4639	chittomo	ちっとも	些とも	 (not) at all, (not) a bit, (not) in the least, (not) in the slightest
5555	4640	saitamaken	さいたまけん	埼玉県	 Saitama prefecture (Kanto area)
5556	4641	ugokeru	うごける	動ける	
5556	4642	katsugu	かつぐ	担ぐ	to shoulder, to carry on one's shoulder | to nominate for a position, to choose as a representative | to take (someone) for a ride, to deceive, to take in | to be caught up in superstition
5556	4643	shouhizei	しょうひぜい	消費税	 consumption tax (incl. sales tax, VAT, excise duty, etc.)
5556	4644	soufu	そうふ	送付	 sending (esp. email attachments), forwarding, remitting
5562	4645	ikkaku	いっかく	一角	corner, section, point, part | one horn | narwhal (Monodon monoceros), ひとかど (一角) a cut above the rest, superior, respectable, full-fledged, something uncommon | one field, one matter | suitably, reasonably
5562	4646	sesshoku	せっしょく	接触	 touch, contact
5562	4647	tagui	たぐい	類い	kind, sort, type | equal, match, peer
5562	4648	butaniku	ぶたにく	豚肉	 pork
5562	4649	yurai	ゆらい	由来	origin, source, history, derivation | originally, from the start, by nature
5562	4650	youryou	ようりょう	容量	capacity, volume | capacitance
5568	4651	konya	こんや	今夜	 this evening, tonight
5568	4652	shinwa	しんわ	神話	 myth, legend
5571	4653	kanchigai	かんちがい	勘違い	 misunderstanding, mistaken idea, wrong guess
5571	4654	kenen	けねん	懸念	 worry, fear, anxiety, concern
5571	4655	koushi	こうし	行使	 use, exercise (of one's right, authority, power, etc.)
5571	4656	seitou	せいとう	政党	 political party
5571	4657	meigara	めいがら	銘柄	brand, make, description | trading name of stocks and securities
5578	4658	otazuneru	おたずねる	御尋ねる	
5578	4659	doro	どろ	泥	mud, slush, (wet) dirt, mire | thief
5578	4660	hassou	はっそう	発送	 sending, forwarding, shipping
5583	4661	kumoru	くもる	曇る	to get cloudy, to cloud over, to become overcast | to cloud up, to fog up, to mist up, to become dim | to be gloomy, to be clouded (expression), to be downcast | to look slightly downward (of a noh mask; indicating sadness, grief, etc.), くぐもる (曇る)  to mumble, to mutter
5583	4662	sakidatsu	さきだつ	先立つ	to lead, to take the lead (in doing something) | to precede, to go before, to take precedence | to die before (esp. one's spouse, parents, etc.) | to be a prerequisite
5583	4663	shinzoku	しんぞく	親族	 relative, relation, うから (親族)  blood relative
5583	4664	daizu	だいず	大豆	 soya bean (Glycine max), soybean, soy
5583	4665	hakujin	はくじん	白人	amateur, layman, ordinary person, novice | respectable woman (i.e. not a prostitute, hostess, geisha) | unlicensed prostitute, はくじん (白人) white person, Caucasian | beginner, amateur | unlicensed prostitute
5583	4666	hokori	ほこり	埃	dust | one ten-billionth
5589	4667	shio	しお	潮	tide, current | sea water | opportunity, chance | thin soup of fish or shellfish boiled in seawater
5589	4668	seibetsu	せいべつ	性別	 gender, distinction of sex, sex
5589	4669	tounan'ajia	とうなんあじあ	東南アジア	 Southeast Asia
5589	4670	ha	は	刃	edge (of a knife or sword) | prong (of an electrical plug), やいば (刃) blade, sword | forged blade, wavy pattern on forged blades | sharpness | unhulled rice
5593	4671	kenchikubutsu	けんちくぶつ	建築物	 building, structure
5593	4672	chiji	ちじ	知事	 prefectural governor
5593	4673	toumen	とうめん	当面	current, urgent, pressing, impending | to confront (an issue), to face (up to something) | for the meantime, at present
5593	4674	buchou	ぶちょう	部長	head (chief, director) of a section or department | head of a (school) club, head of a (school) team
5593	4675	bunri	ぶんり	分離	 separation, partition, detachment, segregation, isolation
5599	4676	ichipai	いちぱい	一杯	amount necessary to fill a container (e.g. cupful, spoonful, etc.), drink (usu. alcoholic) | full | one squid, octopus, crab, etc., one boat | fully, to capacity | a lot, much | all of ..., the entire ...
5599	4677	doukyuusei	どうきゅうせい	同級生	 classmate
5601	4678	atsusa	あつさ	厚さ	 thickness
5601	4679	okuridasu	おくりだす	送り出す	 to send out, to forward, to show (a person) out
5601	4680	kihonhoushin	きほんほうしん	基本方針	 basic policy, fundamental policy, fundamental plan of action
5601	4681	shikisai	しきさい	色彩	 colour, color, hue, tints
5601	4682	noreru	のれる	乗れる	
5607	4683	omoidaseru	おもいだせる	思い出せる	
5607	4684	jiman	じまん	自慢	 pride, boast
5611	4685	okurimono	おくりもの	贈り物	 present, gift
5611	4686	genten	げんてん	原点	starting point, origin, beginning | origin (of coordinate axes) | datum point
5611	4687	korobu	ころぶ	転ぶ	to fall down, to fall over | to turn out, to play out | to abandon Christianity (and convert to Buddhism), to apostatize | to roll, to tumble | (for a geisha) to prostitute (herself) in secret
5611	4688	shouga	しょうが	生姜	 ginger (Zingiber officinale), しょうきょう (生姜)  dried ginger root (trad. medicine)
5611	4689	jiritsu	じりつ	自立	 independence, self-reliance
5611	4690	seizou	せいぞう	製造	 manufacture, production
5611	4691	hirogari	ひろがり	広がり	 spread, span, expanse, extent
5611	4692	mitsu	みつ	満つ	to be full | to wax (e.g. moon) | to rise (e.g. tide) | to mature, to expire
5611	4693	youryou	ようりょう	要領	point, gist, essentials, tenets, outline | knack, trick, the ropes
5622	4694	kankou	かんこう	観光	 sightseeing, tourism
5622	4695	koufu	こうふ	交付	 delivery, issuance, handing over, granting
5622	4696	shutsugen	しゅつげん	出現	 appearance, arrival, make one's appearance
5622	4697	josei	じょせい	助成	 assisting, assistance, fostering, aiding
5622	4698	sesuji	せすじ	背筋	spine, line of the backbone | seam down the back (of clothing), はいきん (背筋)  muscles of the back, back muscles
5622	4699	deguchi	でぐち	出口	exit, gateway, way out | outlet, vent, leak
5622	4700	fubo	ふぼ	父母	 father and mother, parents
